article_id,title,abstract_ar,authors,authors_en,general_field,publish_date,page1,page2,source,path,keywords
1214,تنميه الأكاديميه لدا طلبه الجامعات في ضوء مؤشرات سقف الأداء المرتفع (حاله طلبه جامعه جازان),"هدفت الدراسه الحاليه الا تحديد ممارسات التنميه الاكاديميه لدا طلبه الجامعات في ضوء مؤشرات سقف الاداء المرتفع المستنبطه من ادب التعليم العالي المعاصر. والا التعرف علا تقديرات واقع هذه الممارسات cal طلبه جامعه جازان من وجهه نظر الطلبه انفسهم. ولجمع البيانات. صمم الباحثان استبانه تكونت من (21) فقره. تم التحقق من خصائصها السيكومتريه. وطبقت علا عينه عشوائيه بلغت )691( طالبا وطالبه. وقد ai نتائج الدراسه ان طلبه الجامعه يقدرون واقع ممارسات التنميه الاكاديميه لديهم بدرجه متوسطه. وبمتوسط حسابي بلغ (3,14). وتراوحت متوسطات تقديراتهم ما بين )2,70 - 3,53). كما cin وجود فروق داله احصائيا بين متوسطات تقديراتهم تعزا الا متغير الكليه لصالح JS) من علميه وانسانيه)؛ والا متغير تقدير المعدل التراكمي لصالح تقدير (ممتاز). في حين لم توجد فروق داله احصائيا تعزا الا متغير الجنس.","['وائل محمد سويلم', 'سلمان محمد الشهري']",,Business,2017-01-01,"التنميه الاكاديميه لدا طلبه الجامعات في ضوء
المجله الاردنيه في العلوم التربويه. مجلد 13. sae 4. 2017, 449 - 458
مؤشرات سقف الاداء المرتفع
(حاله طلبه جامعه جازان)
* 3
وائل fall محمد سويلم
خ تسلم البحث 2016/4/9
ملخص: هدفت الدراسه الحاليه الا تحديد ممارسات التنميه الاكاديميه لدا طلبه
الجامعات في ضوء مؤشرات سقف الاداء المرتفع المستنبطه من ادب التعليم العالي
المعاصر. والا التعرف علا تقديرات واقع هذه الممارسات cal طلبه جامعه جازان
من وجهه نظر الطلبه انفسهم. ولجمع البيانات. صمم الباحثان استبانه تكونت من
(21) فقره. تم التحقق من خصائصها السيكومتريه. وطبقت علا عينه عشوائيه
بلغت )691( طالبا وطالبه. وقد ai نتائج الدراسه ان طلبه الجامعه يقدرون واقع
ممارسات التنميه الاكاديميه لديهم بدرجه متوسطه. وبمتوسط حسابي بلغ
(3,14). وتراوحت متوسطات تقديراتهم ما بين )2,70 - 3,53). كما cin 
النتائج وجود فروق داله احصائيا بين متوسطات تقديراتهم تعزا الا متغير الكليه
لصالح JS) من علميه وانسانيه)؛ والا متغير تقدير المعدل التراكمي لصالح تقدير
(ممتاز). في حين لم توجد فروق داله احصائيا تعزا الا متغير الجنس.
(الكلمات المفتاحيه: التنميه الاكاديميه. طلبه الجامعات. مؤشرات الاداء المرتفع 
جامعه جازان).
مقدمه: ازداد اهتمام الجامعات الفاعله منذ مطلع القرن الحادي
والعشرين بتبني استراتيجيات تدريسيه تتمركز حول الطالب كونه حجر
الزاويه في كل جوانب التطوير والتغيير التي تنشدها هذه الجامعات.
والمحور الرئيس في عمليه التعليم والعنصر الحيوي في عمليه التعلم
لتتمكن مخرجاتها من تلبيه متطلبات المجتمع واحتياجاته. ومن مواجهه
التحديات التي فرضتها التطورات الحديثه المتسارعه.
تستدعي هذه المكانه للطالب الجامعي ان يكون في تعلمه جادا قدر
امكاناته. وفعالا قدر ما تسمح به ظروفه. Guat دوره اتقان الماده
العلميه للمقررات الدراسيه الا امتلاك كفايات شخصيه متكامله. وقدرات
مبدعه. ومهارات drole وثقافيه ومهنيه. وانضباط ذاتيء وقدره علا التنميه
الذاتيه المستدامه (الطحاوي. 2010). وتستدعي من الجامعات ان تعمل
بجديه علا تحقيق متطلبات ومعايير الجوده. وان تكون قادره علا مواكبه
التغيرات a فا التعليم العالي واستشراف تطوراته المستقبليه. لتمتلك رؤيه
واضحه لمدخلاتها ولنواتج التعلم فيها.
لذلك فان تقييم الاداء الاكاديمي للجامعات واستحداث اليات
ومتابعه التنميه الاكاديميه bss طلبه الجامعات وتحديد مستويا
فيهاء يلقيان اهتماما متزايدا. حتا اطلق علا القرن الحالي منذ مطلعه
عصر مساءله التعليم العالي وتقييم ادائه )2008 Lagi .(Waterbury, 
يشكلان البدايه الحقيقيه لجوده المؤسسات التعليميه (شحاته. 2012(
لكنهما من اصعب المهام التي يعتني بها القائمون باداره الجوده الشامله في
التعليم العالي (القريشي والموسوي. 2011( لاعتمادهما علا ممارسات
عمل حقيقي تتحدد لها مؤشرات تضيف قيمه لاداء الطالب الجامعي.
e
* كليه التربيه. جامعه جازانء المملكه العربيه السعوديه.
** كليه dy sill جامعه السويس؛ جمهوريه مصر العربيه.
حقوق الطبع محفوظه لجامعه tl go yall اربدء الاردن.
تاريخ قبوله 2017/1/5
وتتاثر التنميه الاكاديميه لدا طلبه الجامعات بعوامل عديده تتعلق
بجامعاتهم, منها قيم الجامعه. فمن مسؤوليه الجامعات ان yas طلبتها
بالقيم التي تتبناهاء وتذكرهم بها باستمرار بمختلف عملياتها وانشطتهاء
وتتبنا وجودها في خارطه اولويات المسؤولين الاداريين واهتمامات
الاكاديميين فيهاء نظرا للاثر الفعال لهذه القيم في بناء مختلف جوانب
شخصيه الطالب الجامعي وتمكينه من تطوير ذاته وتنميه ممارساته
.(Fatoki, 2014) 
والمعارف في التعليم الجامعي لم تعد مقصوده بذاتهاء بل تقد
تدريس حقيقي نشط وفعال يتدرب فيه الطالب الجامعي علا اكتشاف هذه
المعارف واعاده توظيفها بما يتلاءم مع المستجدات والمتغيرات (بابيه
وبابيه. 2012). وهذا يعد من افضل انواع التعلم , كونه يهتم بالنظره
الشامله للطالب الجامعي عقليا ووجدانيا ومهاريا, ويكسبه خبرات تربويه
مباشره وغير Byte ويعيد تشكيل سلوكه. ويزيد دافعيته للتعلم وفقا
لما لديه من استعدادات وقدرات. فيجعل دوره ذا قيمه. ويجعل ادارته
لذاته في التعلم AGE ويدفعه الا المشاركه في نشاطات عقليه حركيه,
والا Lodi مسؤوليه تطوير مهاراته واكتساب مهارات جديده. (بوالليف.
2010(","المجله الاردنيه في العلوم التربويه
ويقتضي ذلك ان تعمل الجامعات علا مساعده طلبتها لتحقيق
التكيف الاكاديمي. بان توفر مقومات خاصه في بيئتها مثل الحريه
والديمقراطيه والعداله والمساواه والموده والتعاطف, لتمكينهم من
توظيف طاقاتهم وقدراتهم وتنميه معارفهم ومهاراتهم الذاتيه
والاكاديميه. وهو ما تؤكده دراسه بني خالد (2010) التي cots 
وجود علاقه ارتباطيه موجبه بين التكيف الاكاديمي والكفاءه الذاتيه
العامه للطلبه, والتي تتمثل في قدرتهم علا تنظيم وتنفيذ انماط من
النشاطات المرغوب فيها لتحقيق مستويات محدده من الاداء.
وتؤكد دراسه مدهوفوزي )2012 (Mudhovozi, ان مشكلات
الطالب الجامعي المتعلقه بالتكيف الاكاديمي علا اختلاف انواعها
تؤثر سلبا علا مستوا ادائه الاكاديمي.
ويتيح تلبيه الجامعات متطلبات جوده التعليم في المناخ
الدراسي وتفاعلاته فرصا جيده امام طلبتها للتنميه الاكاديميه مثل
احداث التوافق الدراسي. والمشاركه الفاعله في عمليتي التعليم
والتعلم, وتنميه اعمالهم الابداعيه وافكارهم ونتاجاتهم العلميه
(جبرء 2012( والقدره علا معايشه غزاره المعلومات وعمليات
التغيير المستمره. والتقدم التكنولوجي الهائلء والتعامل معها
والاستفاده منها بالقدر الكافي لخدمه تعلمهم, وفقا لمعايير واقعيه
تحدد مؤشرات الاداء المطلوب بدقه (العنزي وداودء 2012(
وتساعد في تحديد نماذج تفاعليه تقدم المناخ الدراسي وتفاعلاته
كمتغيرات وسيطه نحو التعلم. فهذا المناخ كما بينت دراسه غريب
والعضايله (2010) له علاقه ارتباطيه Linge بدافعيه الانجاز
الاكاديمي, والذي يعده الخفاجي والزيدي (2013) من ابرز
العوامل المؤثره في العمليه التعليميه والتعلميه بالجامعات. واثاره
تعلم طلبتها وتوجيه سلوكهم التعليمي وتعزيزه واستمراره لتحقيق
الذات والنجاح. وكذلك فهم ادائهم وتفسيره بمختلف مواقف التعلم.
وللمناخ الاداري بالجامعات التاثير نفسه في التنميه
الاكاديميه. شريطه ان يمتلك الموظفون العاملون فيها تصورات
واتجاهات ايجابيه مثل الشعور باهميتهم في العملء وبقدرتهم علا
المشاركه في اتخاذ القرارء وباسهامهم في رسم السياسات والخطط,
وبالثقه بين الاداره والافراد (احمد. 2014). فجوده هذا المناخ
وايجابيه العلاقات التفاعليه بين الطلبه والموظفين يجعل الطلبه
يشعرون بجوده الحياه الاكاديميه. وبامكانيه تحقيق اهدافهم
وطموحاتهم,؛ وترتفع لديهم الروح المعنويه فيواصلون دراستهم
Lat, وترتفع مستويات ادائهم. وهو ما تؤكده دراسه الغنبوصي
)2009( التي بينت ايضا وجود علاقه ارتباطيه Linge بين جوده
المناخ الجامعي وايجابيه علاقاته وبين مستوا الطموح ودافعيه
الانجاز لدا الطلبه.
وتؤثر في التنميه الاكاديميه لدا طلبه الجامعات عوامل اخرا
واكرم )2014 (Ghazanfar Akram, وجود علاقه ارتباطيه
موجبه بين الكفاءه الذاتيه للطالب الجامعي ومستوا ادائه
الاكاديمي. وهو ما اكدته دراسه ابراهيم )2016( التي بيتت ان
انجاز الطالب الجامعي Gad كلما قلت درجه كفاءته الذاتيه.
وتمثل هذه الكفاءه وسيطا معرفيا للسلوك؛ فتوقع الطالب
الجامعي لفاعليته الذاتيه هو الذي يحدد طبيعه سلوكه. ومقدار
الجهد الذي سيبذله. ودرجه المثابره التي سيبديها (بني
خالد.2010). وقد ain دراسه سالم (2012) ان معظم طالبات
dus عجلون الجامعيه اللاتي لديهن مستوا مرتفع من فاعليه الذات
لديهن تقارب في مستوا دافعيه الانجاز الدراسي.
ويعد الذكاء الانفعالي (مثل: bis الانفعالات. والتعاطف.
واداره العلاقات. والدافعيه الذاتيه) مؤشرا حقيقيا لانجاز الطالب
الجامعي ونجاحه وتميز ادائه الاكاديمي. وهو ما تؤكده دراسه
بافثرا وغاندرموهان )2015 ,23511513 .(Chandramohan كما
اشار ماير )2000 (Mayer, الا ان الطالب الجامعي الذي يمتلك
مستويات عاليه من الذكاء الانفعالا يكون اكثر قدره علا اداره
علاقاته ودافعيته الذاتيه. واكثر ضبطا لانفعالاته واندفاعاته. وهذا
يساعده بدرجه كبيره علا تدبر امر الضغوط والتخطيط وتحقيق
الاهداف والمثابره في وجه التحديات والتكيف مع التغيرات ومع بيئه
القاعه الدراسيه. وقد ay دراسه رزيقه (2014) ان الذكاء
الانفعالي يعد مؤشرا لمستوا الطموح لدا الطالب الجامعي. كما
بينت دراسه لجبو واخرين )2016 (Lebo et al., ان هذا الذكاء
يعد ايضا مؤشرا علا تكيف الطالب الجامعي اكاديميا واجتماعيا.
ويؤثر نمط شخصيه الطالب الجامعا (مثل: الانبساطيه مقابل
dail hid والتفكير مقابل الوجدانء والنظام والتخطيط مقابل
العشوائيه والارتجال) في ادائه الاكاديمي, حيث تؤكد دراسه ايراني
واخرين )2003 (Irani et al., التا طبقت قائمه مايرز- بريغز
(Myers- Briggs) للشخصيه كمؤشر لقياس نمط الشخصيه
وعلاقته باداء طلبه الدراسات العليا بجامعه فلوريدا ان هناك علاقه
ارتباطيه موجبه قويه بين نمط شخصيه هؤلاء الطلبه ومعدلاتهم
والسمات الشخصيه للطالب الجامعي (مثل: الحزم واتخاذ
القرارء والاتزان والعقلانيه. والسيطره. والفطنه والذكاء والابداع.
والطموح ودافع الانجاز. وتحمل المسؤوليه والتفاؤلء والثقه
ail, والقابليه الاجتماعيه: والتجديدء والتنافس وتحمل
الضغوط)
وويليام )2006 (Kariuki William, وجود علاقه ارتباطيه
موجبه بين السمات الشخصيه للطالب الجامعا وادائه الاكاديما.
coins دراسه جباره )2013( وجود علاقه ارتباطيه موجبه بين
السمات الشخصيه لطلبه الجامعه الاردنيه Sills بتحصيلهم
تؤثر كذلك فا ادائه الاكاديما. حيث بينت دراسه كاريوكا
الاكاديما.
ويلحظ من ادبيات التعليم الجامعي والدراسات السابقه ان
بعض العوامل الخارجيه المتعلقه بالجامعات. وبعض العوامل",ARPD,finalpdfs/265.pdf,"['التنميه الأكاديميه', 'طلبه الجامعات', 'مؤشرات الأداء المرتفع', 'جامعه جازان']"
