article_id,title,abstract_ar,authors,authors_en,general_field,publish_date,page1,page2,source,path,keywords
618,فعاليه طرق الارشاد النفسي الابداعيه في تعديل معتقدات الضبط وتحسين التمكين النفسي لدا المراهقين,"هدفت الدراسه الحاليه الا فحص فاعليه اساليب الارشاد الابداعيه في تعديل معتقدات الضبط وتحسين التمكين النفسي لدا عينه من المراهقين المسجلين في المدارس العامه للبنين في مديريه التربيه والتعليم في اربد الاردن. تكونت عينه الدراسه من )30( طالبا من الصف العاشر والحادي عشرء تم توزيعهم بشكل عشوائي, في مجموعتين: المجموعه التجريبيه (ن 15). شاركت في برنامج الارشاد الجمعي. والمجموعه الضابطه (ن (15 التي لم تشارك في اي برنامج تدخلء ولتحقيق اهداف Aula تم استخدام مقياسي معتقدات الضبط (CB) والتمكين النفسي (PE) لجمع بيانات الدراسه في الاختبارات القبليه والبعديه لمجموعتي الدراسه؛ وفي الاختبار التتبعي مع افراد المجموعه التجريبيه فقط. بالاضافه الا برنامج ارشادي جماعيء قائم علا الفنون الابداعيه. اظهرت نتائج تحليل التباين المصاحب وجود فروق ذات دلاله احصائيه بين المجموعتين التجريبيه والضابطه في متوسط الدرجات علا مقاييس معتقدات الضبط (CB) والتمكين النفسي (PE) في الاختبار البعدي. ولصالح المجموعه التجريبيه. مما يشير الا فعاليه البرنامج الارشادي. كما اشارت نتائج المقارنات البعديه والتتبعيه لدا افراد المجموعه التجريبيه الا عدم وجود Gord داله احصائيا بين متوسطات القياسين البعدي والتتبعي. في مقياسي معتقدات الضبط (CB) والتمكين النفسي (PE) مما يعكس ثبات تاثير البرنامج. (الكلمات المفتاحيه: طرق الارشاد الابداعيه. معتقدات الضبطء التمكين النفسيء المراهقون).",['doo) الشريفين'],,Arabic,2020-01-01,"المجله الاردنيه في العلوم التربويه. مجلد 16 ste 1 2020, 63-45
فعاليه طرق الارشاد النفسي الابداعيه في تعديل معتقدات الضبط وتحسين التمكين النفسي لدا المراهقين
ع *
doo) الشريفين
تاريخ تسلم البحث 2019/5/21
ملخص: هدفت الدراسه الحاليه الا فحص فاعليه اساليب الارشاد الابداعيه في
تعديل معتقدات الضبط وتحسين التمكين النفسي لدا عينه من المراهقين
المسجلين في المدارس العامه للبنين في مديريه التربيه والتعليم في اربد الاردن.
تكونت عينه الدراسه من )30( طالبا من الصف العاشر والحادي عشرء تم توزيعهم
بشكل عشوائي, في مجموعتين: المجموعه التجريبيه (ن 15). شاركت في برنامج
الارشاد الجمعي. والمجموعه الضابطه (ن (1S التي لم تشارك في اي برنامج
تدخلء ولتحقيق اهداف Aula تم استخدام مقياسي معتقدات الضبط (CB) 
والتمكين النفسي (PE) لجمع بيانات الدراسه في الاختبارات القبليه والبعديه
لمجموعتي الدراسه؛ وفي الاختبار التتبعي مع افراد المجموعه التجريبيه فقط.
بالاضافه الا برنامج ارشادي جماعيء قائم علا الفنون الابداعيه. اظهرت نتائج
تحليل التباين المصاحب وجود فروق ذات دلاله احصائيه بين المجموعتين
التجريبيه والضابطه في متوسط الدرجات علا مقاييس معتقدات الضبط (CB) 
والتمكين النفسي (PE) في الاختبار البعدي. ولصالح المجموعه التجريبيه. مما
يشير الا فعاليه البرنامج الارشادي. كما اشارت نتائج المقارنات البعديه والتتبعيه
لدا افراد المجموعه التجريبيه الا عدم وجود Gord داله احصائيا بين متوسطات
القياسين البعدي والتتبعي. في مقياسي معتقدات الضبط (CB) والتمكين النفسي
(PE) مما يعكس ثبات تاثير البرنامج. ١ 
(الكلمات المفتاحيه: طرق الارشاد الابداعيه. معتقدات الضبطء التمكين النفسيء
المراهقون).
مقدمه: Le Like يقاوم العديد من المراهقين المشاركه في العلاج
النفسيء ومن اجل Wall من مقاومتهم؛ فاننا بحاجه الا التدخلات
الارشاديه التي تتناسب مع طبيعه النموء والتي تتطلب تفاعلا لفظيا اقل
sit. (Riley, 1993) عمد المنظرون وعلماء الارشاد النفسي لابتكار
طرق علاجيه تساعد المراهقين علا التعبير عن انفسهم بشكل اكبر من
العلاج التقليدي )2001 (Hanes, منطلقين من فكره ان توظيف بعض
طرق واساليب الابداع الشخصي في البرامج الارشاديه. يؤدي الا تسهيل
عمليه النمو وزياده الوعي لدا المسترشد ( Mitchell Campbell, 
1972( وذلك من خلال توفير الفرص للمسترشدء لكي يعيش الخبره
ويزود بالطاقه التي تجعله اكثر حساسيه تجاه نفسه والاخرين ( Smith, 
1؛ ما يجعل استخدام الاساليب الابداعيه في برامج الارشاد النفسي
وسيله فعاله تساعد في الكشف عن الخبرات الداخليه capil وتسهل
عمليات الكشف عن النفس.
وقد اثبت العلاج Gill بوصفه احد صور العلاج الذي يستخدم
الطرق الابداعيه في برامج الارشاد النفسيء فاعليته في مساعده المراهقين
علا حل المشكلات. وزياده تقدير الذاتء. cling المهارات الاجتماعيه
واداره السلوك )2010 .(Edgar-Bailey Kress, 
* جامعه اليرموك - الاردن.
حقوق الطبع محفوظه لجامعه اليرموكء اربدء الاردن.
تاريخ قبوله 2019/8/1
Ahmad AlI-Shraifin, Yarmouk University, Jordan.
وقد استفاد الباحثون من المدا الواسع للتطبيقات والمبادئ التي
يوفرها الارشاد الجمعي وبرامجه المختلفه في مجالي الوقايه والعلاج حيث
تم دمج المفاهيم والافتراضات التي تقوم عليها الاساليب الابداعيه في
الارشادء مع عدد من المبادئ والتطبيقات الارشاديه والتدريبيه Areal) 
لوضع نماذج علاجيه توظف الطرق الابداعيه بطريقه جيده في تلك
البرامج. وقد ظهرت بعض النماذج من برامج الارشاد الجمعي المستنده
الا الاساليب الابداعيه بهدف استخدامها خلال تدريب المسترشدين علا
بعض الاساليب التي تساعدهم في تغيير معتقدات الضبط وتحسين مستوا
التمكين النفسي لديهم؛ بحيث يصبحون علا وعي dy SG ومدركين
لعلاقه تفكيرهم بسلوكياتهم: وقادرين علا استبداله بطرق تفكير تكون اكثر
موضوعيه. وتعديل استجاباتهم في التعامل مع مواقف الحياه المختلفه.","المجله الاردنيه في العلوم التربويه
ويوظف الارشاد النفسي باستخدام الطرق والاساليب الابداعيه
مختلف الفنون كالرسمء والرقصء والموسيقاء. والشعرء والكتابه,
والدراماء والسيكودراماء في بيئه داعمه للتجربه وفي التعبير عن
المشاعر(2015 .(Koiv Kaudne, ويطلق علا العلاج
باستخدام الاساليب الابداعيه Gal العلاج بالفنون التعبيريه. اا
العلاج الفني المتكامل؛ الذي يتضمن استخدام مجموعه متنوعه من
الفنون في برامج الارشاد والعلاج النفسي ( Graham Sontag, 
ayy .(2001 العلاج بالفنون التعبيريه علا انه: استخدام انواع
عديده من الفنون مثل الرقصء والدراماء والموسيقاء والرسم,
والتصوير الفوتوغرافي2. والنحت2 والكتابهءه والشعرء والدراماء
والمسارح المضمنه في سياق العلاج النفسي. او الارشادء اا اعاده
.(Adibah Zakaria, 2015( (uals كما عرف العلاج
بالفنون التعبيريه بانه: تقنيات ابداعيه متكامله2. ومولده للنمو,
(Riley, 1993) الشخصي 
wos غرين ودروز )2013 (Green Drewes, ان
تاسيس الثقه هو الهدف الاساسي في العلاج عن طريق الفن؛ اذ
يوفر علاقه امنه بين المعالج والمسترشد. واضاف هانيس
(Hanes, 2001) ان Gall المطبق في اطار علاقه علاجيه موثوقه
يكون lads في بناء الشجاعه لمواجهه المخاوفء واعاده بناء تقدير
الذات. وتعليم مهارات حل المشكلات لاولئك الذين يعانون من
مشاكل متعدده. كما اشار فرانكلين )2000 (Franklin, الا ان
العمليه العلاجيه توفر للفرد مساحه نفسيه للتامل في افكاره
ومشاعره وسلوكياته اثناء قيامه بممارسه النشاط الابداعي. واقترح
ان عمليات الوعي والاستبصار بالتفكير والشعور والاحاسيس
والسلوك الخاص بالفرد الناتجه عن هذه العمليه. تؤدي الا حدوث
التغييرات الهادفه داخل الفرد.
وينظر للاساليب الابداعيه في الارشاد باعتبارها قدره المرشد
علا التفكير خارج ما ga تقليديء والانفتاح علا الخبره الجديده
والحريه في التعبير لكل من المرشد والمسترشد ( Gladding, 
2014( وذلك بهدف تسهيل عمليه النمو وزياده وعي المسترشد
وتحرره من المخاوف )1972 .(Mitchell Campbell, ولا
يتم ذلك الا من خلال اتاحه المجال للمسترشد لان يعيش الخبره
الجديده. وامداده بالطاقه التي تجعله اكثر حساسيه تجاه نفسه
والاخرين )2011 (Smith, مما يساعده علا التطور والتعبير عن
افكاره وسلوكه ومشاعره بشكل كاملء مع زياده معدلات احساسه
بالتمكين النفسي (2009 (Leggett, ويمكن للاساليب الابداعيه
ايضا تسهيل التماسك في المجموعات الارشاديه. وتزويد
المسترشدين بفرصه لاكتشاف مهاراتهم او الجوانب الخفيه في
شخصياتهم )2007 .(Veach Gladding, 
ويمكن استخدام الاساليب الابداعيه في الارشاد مع مختلف
المراحل العمريه نظرا للدور الذي تلعبه هذه الاساليب في تنميه
كل من المرشد والمسترشد.ء وتطوير مهنه الارشاد من خلال
46
استخدامها لاساليب غير تقليديه )2014 .(Gladding, ويسهل
الابداع والابتكار المستخدم مع المسترشدين خلال العمليه
التكيف وحل المشكلات الشخصيه. كما تسهل الفنون التعبيريه
الوعي الذاتي. ويمكن ان تكون العمليه الابداعيه جذابه بشكل
طبيعي ومهدئه للذات. وقد يساعد التعبير الابداعي في تحقيق
الوعي )2017 (Thomas Morris, ويعود ذلك الا ان
المسترشدين غالبا ما يكونون قادرين علا التعبير عن المشاعر او
الخبرات من خلال الفنون الابداعيه بطريقه Y يستطيعون التعبير
عنها شفهيا )2010 .(Edgar-Bailey Kress, 
ونظرا GY المراهقين يمرون في مرحله انتقاليه بين مرحله
الطفوله والرشدء. Gla الاساليب الابداعيه قد تكون بمثابه وسيله
gall اكثر من كونها مقاربه او اسلوب معرفي تقليدي )5 Koiv 
Kaudne, 1 (. فمن الناحيه التطوريه. تعد التدخلات
التعبيريه اكثر ملاءمه؛ ان ان Cul هؤلاء المراهقين قدرات علا
التفكير والشعور التجريدي؛ ما يمكنهم من التعبيرات اللفظيه وغير
اللفظيه للافكار والمشاعر والسلوكيات بيسر وسهوله؛ من خلال
استخدام الاساليب الارشاديه التي تجمع بين كل من الكلام 
و اللعب )2015 .(Adibah Zakaria, وهذا ما اكده
كابوزي وجروس )2013 (Capuzzi Gross, )3 اشارا الا ان
استخدام الاساليب الابداعيه المختلفه يمكن ان يكون مفيدا في
مساعده المراهقين علا التعامل مع المشكلات العاطفيه واكتساب
الوعي الذاتي. كما اشار لوبيز وبيرت )2013 (Lopez Burt, 
الا ان استخدام الابداع في تقديم الارشاد للمراهقين مفيد لعده
اسباب هي: الترابط بين العقل والجسمء وزياده تدفق الطاقه
والتركيز علا الهدف. وتنميه celal وتنميه الشعور بالذاتء
وانشاء تدخلات dled يمكن ان تعزز التعاون والتكيف النفسي
والاجتماعي لهم.
وهناك العديد من المزايا التي تترتب علا استخدام المرشدين
التدخلات الابداعيه او الاساليب الابداعيه في الارشاد مع طلبه
المدارس الثانويه؛ ان يمكن ان تسهم في بناء العلاقه الارشاديه,
وتعزيز التواصل بين المرشد والمسترشدينء. ومساعده المراهقين
علا التعرف علا معتقداتهم. وتشجيع التعبير عن الذات2 وتزويد
المرشد النفسا بمجموعه متنوعه من الادوات العلاجيه
.(Gladding, 2011) وعليه. فان استخدام الاساليب الابداعيه
يتيح للمرشد النفسي التعامل مع مشكله المراهق من وجهات نظر
متعدده الحواسء والاستفاده من اسلوب التعلم المرئا والسمعا
والتجريبي (2013 (Lopez Burt, مما يساعد علا تلبيه
احتياجات المرشد النفسي لتبني منهج علاجي متعدد الاوجه
لمساعده المراهقين )2012 .(Slyter, 
يتضمن العلاج بالفنون الابداعيه مجموعه واسعه من جميع
العلاجات المستنده الا الفنون مثل: atl) والرقصء. والحركه,
والدراماء والفن والموسيقا. وقد وصفت الفنون التعبيريه بانها",ARPD,finalpdfs/213.pdf,"['طرق الارشاد الابداعيه', 'معتقدات الضبط', 'التمكين النفسي', 'المراهقون']"
