article_id,title,abstract_ar,authors,authors_en,general_field,publish_date,page1,page2,source,path,keywords
1212,العلاقه بين الذكاء الناجح وممارسته في التعليم لدا معلمي المدارس الخاصه بمدينه عمان,هدفت هذه الدراسه التعرف الا العلاقه بينتقدير الذكاء الناجح وممارسته في التعليم لدا معلمي المدارس الخاصه بمدينه عمان خلال الفصل الاول من العام الدراسي 2015/2016. وشملت العينه (221) معلما ومعلمه للمواد الانسانيه والعلميه. وتم تطوير واستخدام قائمه تقدير الذكاء الناجح المكونه من ثلاثه ابعاد هي: الذكاء التحليلي والابداعي والعمليء بالاضافه الا مقياس ممارسه التعليم للذكاء الناجح الذي شمل اربعه ابعاد هي: التعليم للذكاء التحليليء والابداعي.واعاده الانتاج والعملي. واشارت النتائج الا ان مستوا الذكاء الناجح لدا العينه جاء مرتفعا. اما مستوا ممارسته في التعليم فقد جاء متوسطا. وكشفت الدراسه علاقه موجبه وداله احصائيا بين الذكاء الناجح وممارسته في التعليم.كما كشفت نتائج تحليل الانحدار ان الذكاء الناجح لدا العينه يتنبا بممارستهم له في التعليم (نسبه التباين المفسر- 56 ( ply تكشف الدراسه فروقا Us احصائيا في الذكاء الناجح تعزا الا الجنس والتخصص الاكاديمي. في حين وجدت فروقا داله احصائيا في ممارسته في التعليم تعزا الا التخصص الاكاديمي لصالح التخصصات العلميه. ولم توجد فروق داله احصائيا تعزا الا الجنس. واخيرا اوصت الدراسه بتدريب المعلمين علا ممارسه الذكاء الناجح في التعليم وخصوصا تعليم الذكاء الابداعي.,"['مديحة محمد العتوم', 'سارة محمد العتوم']",,Business,2017-01-01,"المجله الاردنيه في العلوم التربويه. مجلد 13 sae 4. 2017. 419 - 431
العلاقه بين الذكاء الناجح وممارسته في التعليم لدا معلمي المدارس
الخاصه بمدينه عمان
تاريخ تسلم البحث 2017/2/20
ملخص: هدفت هذه الدراسه التعرف الا العلاقه بينتقدير الذكاء الناجح وممارسته
في التعليم لدا معلمي المدارس الخاصه بمدينه عمان خلال الفصل الاول من العام
الدراسي 2015/2016. وشملت العينه (221) معلما ومعلمه للمواد الانسانيه
والعلميه. وتم تطوير واستخدام قائمه تقدير الذكاء الناجح المكونه من ثلاثه ابعاد
هي: الذكاء التحليلي والابداعي والعمليء بالاضافه الا مقياس ممارسه التعليم
للذكاء الناجح الذي شمل اربعه ابعاد هي: التعليم للذكاء التحليليء والابداعي.
واعاده الانتاج والعملي. واشارت النتائج الا ان مستوا الذكاء الناجح لدا العينه
جاء مرتفعا. اما مستوا ممارسته في التعليم فقد جاء متوسطا. وكشفت الدراسه
علاقه موجبه وداله احصائيا بين الذكاء الناجح وممارسته في التعليم.كما كشفت
نتائج تحليل الانحدار ان الذكاء الناجح لدا العينه يتنبا بممارستهم له في التعليم
(نسبه التباين المفسر- 56 ( ply تكشف الدراسه فروقا Us احصائيا في
الذكاء الناجح تعزا الا الجنس والتخصص الاكاديمي. في حين وجدت فروقا داله
احصائيا في ممارسته في التعليم تعزا الا التخصص الاكاديمي لصالح التخصصات
العلميه. ولم توجد فروق داله احصائيا تعزا الا الجنس. واخيرا اوصت الدراسه
بتدريب المعلمين علا ممارسه الذكاء الناجح في التعليم وخصوصا تعليم الذكاء
الابداعي.
الخاصه).
مقدمه: تعد نظريه الذكاء الناجح من النظريات النفسيه الحديثه في
الذكاء التي تحتوي علا مضامين مهمه في عمليه التعلم والتعليم. سواء
في طرق التعليم واستراتيجياته ام في طرق التقييم. وتاتي اهميه النظريه
من اشتمالها علا ثلاثه مكونات متفاعله هي: التحليليه والابداعيه
والعمليه.ويفترض ان يعرف المعلم ما يفهمه الطلبه بالفعل اثناء تعليمهم,
بالاضافه الا توجيههم الا تحليل المعلومات بشكل مناسب. ووضع الاسس
الاجرائيه لتطبيقها عملياء وتعليمهم طرق انتاج وابتكار المعرفه واعاده
انتاجها او تذكرها.وتحتاج هذه العمليه الا بذل المزيد من الجهد
والتخطيط والدافعيه العاليه لديه )2008 (Hunt, 
وسوف يجد المعلم الناجح الادله والحجج التي يمكن ان يقبلها
طلبته خلال عمليه التعليم التي من شانها ان تسهم في رفع مستوا
تعلمهم والوصول الا التفوق. وقد ركز ستيرنبيرغ وجريجورينكو
(Sternberg Grigorenko, 2004) علا اهميه ان يجد المعلم شكل
التفكير الذي يسهم في تفوق طلبته. بالاضافه الا اهميه التركيز علا
وراا ستيرنبرغ )2003 (Sternberg, ان المعلم سينجح في اداء
عمله حينما يستفيد من مصادر قوته الذاتيه. ويعمل علا تصحيح ما لديه
من نقاط ضعفء. ويمزج مهاراته المختلفه بطريقته الخاصه. ثم يبدا بالعمل
علا احداث التوازن بين قدراته ومهاراته من اجل تحقيق التوافق مع البيئه,
وتشكيل السلوك المناسب داخل البيئه السليمه.
* كليه الاميره lle جامعه البلقاء التطبيقيه- الاردن.
حقوق الطبع محفوظه لجامعه tl go yall اربدء الاردن.
تاريخ قبوله 2017/5/22
Sig ستيرنبيرغ )2005 (Sternberg, علا عدم وجود طريقه
واحده يحقق من خلالها المعلمون النجاح في مجال العمل الواحد, اذ
يمكن لكل معلم ان يتفوق بطريقه مختلفه عن الاخر؛ فبعضهم يمكن ان
يكونوا افضل في تقديم المحاضرات الكبيره. وبعضهم Say ان يتفوقوا في
المحاضرات الصغيره وحلقات النقاش. في حين يمكن ان يجيد البعض
الاخر التوجيه للطلبه فردا فردا. وهذا يشير الا عدم وجود صيغه واحده
يمكن ان تعمل لدا كل المعلمين في عملهم.
ويشير مفهوم الذكاء الناجح الا انه قدره الفرد علا تحقيق
من اهداف الحياه. في سياق اجتماعي وثقافي معينينء من خلال الاستفاده
من نقاط قوته ومعالجه نقاط ضعفه من اجل التكيف والبناء. واختيار
البيئات المناسبه. Wig بواسطه المزج بين قدراته التحليليه والابداعيه.
والعمليه. كما يشير الذكاء الناجح الا قدره الفرد علا تحقيق النجاح في
ضوء معاييره Asli بالاضافه الا السياق الثقافي والاجتماعي الذي
ينتمي اليه )2003 .(Sternberg, 2015; Sternberg, 
هدف ما","المجله الاردنيه في العلوم التربويه
ويرا ستيرنبيرغ )2004 (Sternberg, ان هناك ثلاثه مظاهر
للذكاء الناجح تتمثل بالذكاء التحليلي Analytical intelligence 
(الذي يشير الا قدره الفرد علا تسخير مهاراته في عمليه التحليل,
والتقويم؛ Sally والمقارنه Cute وايجاد التناقض). والذكاء
الابداعي Creative intelligence (الذي يشير الا قدره الفرد علا
تسخير مهاراته في عمليات الابداع والاختراع والاكتشاف والتخيل,
والتصميم؛ وصياغه الافتراضات. cling الفروضء وذلك عندما يواجه
الفرد موقفا يتطلب حلا (loge والذكاء العملي Practical 
ill) intelligence يشير الا قدره الفرد علا تضمين كل
مهاراته وتسخيرها بصوره عمليهء في سياق عالمه الواقعي
(الحقيقي). بحيث تتكون لديه الخبره علا ان يحقق توافقا مع بيئته.
ويشكل سلوكات ملائمه للمواقف التي يمر بهاء ويمكن التوصل
للمهارات العمليه من خلال legs تتطلب الاستخدام. والتطبيق,
والتنفيذء والتوظيفء والتاطير المنطلق من فهم السياق).
ويكمن الجزء المهم في ذكاء الفرد في قدرته علا التنسيق
بين المظاهر الثلاثه للذكاء. ومعرفه متا يستخدم bl منها في
الوقت المناسب. ويتوقف نجاح الفرد علا ايجاد التكامل بين
المظاهر الثلاثه للذكاء من خلال التوازن والتنسيق والتناغم. وهذا
التكامل بين القدرات يمكن ان يتغير عبر الزمنء GY الذكاء يمكن ان
ينمو ويتطور في اتجاهات متعدده. حيث تتسم هذه المظاهر
dig pall ومن ثم يمكن تنميتها للافضل من خلال التنشته والتدريب
.(Sternberg Grigorenko, 2000) 
ويساعد التعليم المنبثق عن نظريه الذكاء الناجح المعلمين
OY يصلوا الا شريحه اوسع من ALAN مقارنه مع الطرق التقليديه
في التعليم التي تؤكد علا الذاكره والتعليم التحليلي وتتجاهل
التعليم الابداعي والعملي )2004 .(Sternberg Grigorenko, 
ويقدم التعليم وفقا لنظريه الذكاء الناجح فوائد متعدده لكل
من المعلمين والطلبه ومدارسهم ومجتمعاتهم؛ فاتباع المعلمين لهذا
النوع من التعليم يعمل علا زياده تحفيزهم نحو التعليم, مما يقود
الا فعاليه اكبر للتعليم. كما يساعد الطلبه علا تحقيق مستوا
متقدم يتلاءم مع مهاراتهم التي يمكن استخدامها في تسهيل التعلم,
بدلا من تركها Gad سدا. كما يمكن هذا التعليم المدارس
للوصول الا مستويات اعلا من الانجاز بشكل شمولي. ويساعد
ايضا المجتمعات لكي تستفيد بشكل افضل من مواردها البشريه من
خلال استغلال مواهب ابنائها بالشكل المطلوب ( Sternberg, 
2002(
ol (Kaufman Singer, 2004) ويرا كوفمان وسنجر 
تطبيق نظريه الذكاء الناجح يمكن ان ينجح في مجالات مختلفه
منها: مجال العلاج النفسي2. وتدريب المعلمين لتنميه مهاراتهم
الضروريه التي يمكن ان يمارسوها اثناء التعامل مع الطلبه الاطفال
والمراهقين. كما يمكن ان تجدي مع الراشدين للتعامل مع المواقف
ويمكن للمعلمين ان يطبقوا نظريه الذكاء الناجح في تعليم
القدرات التحليليه من خلال الانشطه التعليميه التي تتضمن عمليات
التقييع. والتحليل.ء والحكم. والمقارنهء والتفكير المنطقيء
والمناقشه. والبحوث. Gag المسائل الحسابيه.كما يمكن تعليم
القدرات الابداعيه من خلال الانشطه التي تهدف الا تنميه القدره
علا توليد افكار جديده. وانشاء وتصميم اشياء جديده. ويتم
تقييم تلك القدرات بشكل خاص من خلال معالجه مشكلات تسلط
الضوء علا مدا التواؤم مع الحداثه النسبيه. ويمكن تعليم القدرات
العمليه من خلال الانشطه التي تساعد الطلبه علا تطبيق قدراتهم
في حل المشكلات التي تواجههم في الحياه اليوميه؛ كالمشكلات التي
تحدث في البيت او العملء والمساهمه في تنميه قدراتهم في القياده
والتفاعلات الاجتماعيه المختلفه. وينبغي علا المعلمين التركيز علا
نقاط ضعف طلبتهم في القدرات السابقه ومعالجتها اكثر من الحرص
علا امتلاكهم لجميع القدرات بمستويات عاليه ) Sternberg, 
2002(.
وقد وضع ستيرنبيرغ )1998 (Sternberg, عددا من المبادئ
التي يمكن توظيفها في عمليه التعليم بما ينسجم مع نظريه الذكاء
الناجح, تتمثل بان الهدف من التعليم هو تشكيل الخبرات من خلال
التنظيم الجيد والمرنء واسترجاع قاعده المعرفه بسهوله. ويجب ان
يدمج التعليم مكونات الذكاء الناجح الثلاثه (التحليلي والابداعي
والعملي) Way من الفصل بينهاء او التركيز علا التعليم والتقييم
الموجه نحو الذاكره. كما يجب ان يمكن التعليم الطلبه من تحديد
مواطن قوتهم للاستفاده منهاء ومواطن ضعفهم لمعالجتها. ويجب ان
يستخدم التعليم ما وراء خطوات حل المشكلات في اوقات مختلفه
ويجب ان ينطوي ايضا علا سته اداءات علا الاقل في مختلف
الاوقات. وهي: ترميز المعلومات.ء والاستدلال.ء والتخطيط,
والتطبيق ومقارنه البدائل والاستجابه. وينبغي ان يتضمن التعليم
استخدام ثلاثه مكونات لاكتساب المعرفه. هي: الترميز ABBY 
والمقارنه الانتقائيه والتركيب الانتقائي. هذا فضلا عن ضروره
مراعاه الفروق الفرديه فا التمثيلات العقليه المفضله لدا الطلبه
كالتمثيلات اللفظيه. والكميه. والشكليه. اضافه الا المدخلات
السمعيه والبصريه. والمخرجات الكتابيه والشفويه. وتجدر الاشاره
الا ان التعلم الامثل للفرد هو الحديث نسبيا الذي يصبح LA) بعدما
يتمثل الخبرات بشكل جيد. واخيرا يجب ان يساعد التعليم الطلبه
علا التكيف. والتشكلء واختيار البيئات المناسبه.
وتوصلت بالسووماريكتوي )2013 (Palso Maricuoiu, 
بالاستناد الا نظريه ستيرنبيرغ (Sternberg) ودراساته الا اربعه
ابعاد لتطبيق نظريه الذكاء الناجح في التعليم هي:
1- تعليم اعاده الانتاج: يقصد به التعليم الموجه gai الحفظ
والتذكر من خلال اعاده انتاج المعرفه او صياغتها بعد تمثلها
جيدا. ويهدف هذا التعليم الا تشكيل القاعده الاساسيه
للمعرفه حول موضوع gro اذ ان توافر هذه القاعده",ARPD,finalpdfs/263.pdf,"['ذكاء ناجح', 'ممارسات التعليم', 'معلمي المدارس الخاصة', 'عمان', 'الذكاء التحليلي', 'الذكاء الابداعي', 'الذكاء العملي']"
