article_id,title,abstract_ar,authors,authors_en,general_field,publish_date,page1,page2,source,path,keywords
612,فاعليه الارشاد الجمعي المستند الا البرمجه اللغويه العصبيه في تنميه الصفات السلوكيه ومهارات الاتصال اللفظي,هدفت الدراسه الا الكشف عن فاعليه برنامج ارشاد جمعي يستند الا البرمجه اللغويه العصبيه في تنميه الصفات السلوكيه ومهارات الاتصال اللفظي لدا الطلاب المتفوقين في كليه التربيه بجامعه نجران. واستخدم المنهج التجريبي تصميم المجموعه الواحده بقياسات قبليه وبعديه. تكونت عينه الدراسه من (12) طالبا متفوقا في GIS التربيه بجامعه نجران في المملكه العربيه السعوديه. وقد تم تطوير برنامج ارشاد جمعي يستند الا البرمجه اللغويه العصبيه. حيث تكون البرنامج من )14( جلسه ارشاديه جماعيه مده كل منها (60) دقيقه. واستغرق تطبيقه علا عينه الدراسه مده اربعه اسابيع واستخدم بالدراسه مقياس الصفات السلوكيه ومقياس مهارات التواصل اللفظي. واظهرت النتائج وجود فروق داله احصائيا في درجات افراد المجموعه التجريبيه بين القياسين Lill والبعدي علا مقياس الصفات السلوكيه ومقياس مهارات التواصل اللفظي ومجالاتهما لصالح القياس البعدي؛ ما يؤكد فاعليه برنامج الارشاد الجمعي المستخدم في تنميه الصفات السلوكيه ومهارات الاتصال اللفظي لدا الطلاب الجامعيين المتفوقين.,"['برهان حمادنه', 'رايق القحطاني']",,Arabic,2020-01-01,"المجله الاردنيه في العلوم التربويه. مجلد 16 sre 2. 2020, 222-205
فاعليه الارشاد الجمعي المستند الا البرمجه اللغويه العصبيه في تنميه
الصفات السلوكيه ومهارات الاتصال اللفظي
*
برهان حمادنه و راقع القحطاني
تاريخ تسلم البحث 2019/4/21
ملخص: هدفت الدراسه الا الكشف عن فاعليه برنامج ارشاد جمعي يستند الا
البرمجه اللغويه العصبيه في تنميه الصفات السلوكيه ومهارات الاتصال اللفظي لدا
الطلاب المتفوقين في كليه التربيه بجامعه نجران. واستخدم المنهج التجريبي
تصميم المجموعه الواحده بقياسات قبليه وبعديه. تكونت عينه الدراسه من (12)
طالبا متفوقا في GIS التربيه بجامعه نجران في المملكه العربيه السعوديه. وقد تم
تطوير برنامج ارشاد جمعي يستند الا البرمجه اللغويه العصبيه. حيث تكون
البرنامج من )14( جلسه ارشاديه جماعيه مده كل منها (60) دقيقه. واستغرق
تطبيقه علا عينه الدراسه مده اربعه اسابيع واستخدم بالدراسه مقياس الصفات
السلوكيه ومقياس مهارات التواصل اللفظي. واظهرت النتائج وجود فروق داله
احصائيا في درجات افراد المجموعه التجريبيه بين القياسين Lill والبعدي علا
مقياس الصفات السلوكيه ومقياس مهارات التواصل اللفظي ومجالاتهما لصالح
القياس البعدي؛ ما يؤكد فاعليه برنامج الارشاد الجمعي المستخدم في تنميه
الصفات السلوكيه ومهارات الاتصال اللفظي لدا الطلاب الجامعيين المتفوقين.
(الكلمات المفتاحيه: الارشاد الجمعيء البرمجه اللغويه Ayal الصفات
السلوكيه. مهارات الاتصال اللفظيء الطلبه المتفوقين. جامعه نجران)
مقدمه: تعد الفروق الفرديه بين البشر في خصائصهم وقدراتهم
حقيقه لا جدال فيهاء منذ وجد الانسان علا هذا الكوكب. ومن الطبيعي
ان تظهر البشريه اهتماما ols بالافراد الذين تميزوا بقدراتهم, او
تفوقهم بصوره استثنائيه في احد مجالات النشاط الانساني التي يقدرها
المجتمع. ويطلق عليهم اسم الطلبه المتفوقين ( Outstanding 
lighs (Students فان هذه الفئه من الافراد تحتاج الا مجموعه من
الاساليب الارشاديه التي تتناسب مع احتياجاتهم؛ وتتوافق مع خصائصهم
وقدراتهم. وهذا يقود الا ان هذه الفئه من المجتمع الانساني تحتاج الا
الرعايه والعنايه الخاصه. وتصميم ما يناسبها من برامج مختلفه من
الارشاد النفسي ومجالاته. واستجابه للحاجات الارشاديه الخاصه بفئه
الطلبه المتفوقين. فقد اجريت الدراسه الحاليه وسعت الا الكشف عن
فاعليه برنامج ارشاد جمعي يستند الا البرمجه اللغويه العصبيه في تنميه
الصفات السلوكيه ومهارات الاتصال اللفظي لدا عينه من طلاب كليه
التربيه المتفوقين في جامعه نجران بالمملكه العربيه السعوديه.
ويستند ارشاد المتفوقين الا ما يسما الحاجه الارشاديه. وتمثل
رغبه الافراد في التعبير عن مشكلاتهم باسلوب منظم بهدف اشباع
حاجاتهم المختلفه. التي لم يستطيعوا اشباعها من تلقاء انفسهم؛ نظرا
لانهم لم يكتشفوها او انهم اكتشفوها ولم يستطيعوا اشباعهاء الامر الذي
يجعلهم بحاجه الا خدمات ارشاديه debs لتعلم كيفيه اشباع هذه
الحاجات, او التكيف مع فقدانها ليتمكنوا من تحقيق التكيف النفسي
والاجتماعي والاكاديمي مع ذاتهم ومع الاخرين Al Zraiqat, Al) 
.(Rehani Tanous, 2010 
* جامعه نجران - المملكه العربيه السعوديه.
حقوق الطبع محفوظه لجامعه اليرموكء اربدء الاردن.
تاريخ قبوله 2019/10/20
وقد بدا الاهتمام بالحاجات الارشاديه للطلبه المتفوقين متاخرا ثلاثه
عقود Ge بدايه الاهتمام بحاجاتهم التربويه والتعليميه. حيث اهتمت حركه
تعليم المتفوقين بدايه بتامين الحاجات التربويه والتعليميه لهم ثم ظهرت
اتجاهات تهتم بالحاجات الارشاديه الشخصيه. والاجتماعيه. والانفعاليه,
والاسريه. والاقتصاديه (2008 .(Jarwan, ويتميز الارشاد الجمعي
باساليب وخصائص فريده ربما تجعله اكثر فاعليه في تعديل السلوكء
وتطوير الاتجاهاتء وتنميه مهارات الاتصال الاجتماعي Jladll وفهم الذات
وتقديرها ضمن اطار الجماعه. ذلك ان الارشاد الجمعي يركز علا
خبرات افراد المجموعه ومواقفهم ازاء القضيه المطروحه. كما ان
التفاعل بين افراد المجموعه يساعدهم علا تبادل المعارف.
والمعلومات2. والافكار. والخبرات2. واستكشاف مشاعر الاخرين
وطرق تواصلهمء واختبار المشاعر والاتجاهات الشخصيه.","المجله الاردنيه في العلوم التربويه
وتستخدم اساليب الارشاد الجمعي بصوره خاصه في معالجه
قضايا الارشاد الوقائا المبنيه علا الحاجات المتوقعه للطلبه. وفا
..(Hamadneh, 2014) 
les الرغم من ان الطلبه الجامعيين المتفوقين يحققون
احتياجاتهم ورغباتهم وطموحاتهم من خلال العمل cael الا ان
العواطف البشريه قد تتاثر بعوامل عديده. بما فا ذلك العوامل
البيئيه والتنظيميه الجامعيه غير المواتيه, التي يسيطر عليها التنافس
والحاجه الا التفوق. لذلك. قد يكون نوع الموقف وطبيعه ونوعيه
الجهد المطلوب لتحقيق التفوق من بين الضغوطات الرئيسيه التي
يمكن ان تولد لدا هؤلاء الطلبه ضغوطا تعرقل تلبيه متطلبات
بعض الجوانب الشخصيه والاجتماعيه المفترض تاديتها في هذه
المرحله العمريه بصوره طبيعيه. ومع lS قد لا يتمتع بعض الطلبه
ذوا القدرات العاليه بالنضج او الخبرات السابقه لتنميه الصفات
السلوكيه ومهارات الاتصال اللفظي لديهم. اللازمه للاحتفاظ
بتفوقهم. ولتشكيل شبكات دعم الزملاء
والمدرسين وغيرهم. كما انهم يواجهون تحديات فريده مثل
تعرضهم لزياده وتيره التنمر Jeremy, Fisher, ( pass 
2) ولا يقتصر الامر علا تعرض هؤلاء الطلبه لتحديات يمكن
(Dougherty, 2007) وللاسف. غالبا ما يتم تجاهل حاجات
هؤلاء الطلبه في عمليه تقديم الارشاد النفسي والاكاديمي: لانهم
يتفوقون عاده في دراستهم. ويبدا انهم في كثير من الاحيان
يعملون بطريقه تعتمد علا الذات. ويفترض المعلمون عن طريق
الخطا ان الطلبه المتفوقين لا يحتاجون الا الكثير من التوجيهات,
لانهم مستقلون ولديهم دوافع ذاتيه ويعرفون كيف يحققون اهدافهم
.(Glennen Martin, 2000) 
ونظرا لارتباط الحاليه بالحاجات لدا الطلبه
المتفوقين. والحاجه الا توفير برامج خاصه لتعليمهم وتدريبهم,
والحاجه الا تنميه الصفات السلوكيه ومهارات الاتصال اللفظي
equal يبدو ان الارشاد الجمعي من اكثر الاساليب الفعاله في تعديل
السلوك وتنميه المهارات equal وهذا ما اثبتته الدراسات السابقه
التي اجريت في هذا المجال Ali, 2002; Al Shahat, Al) 
(Ballah, 2013 التي اثبتت كفاءه الارشاد الجمعي في علاج
العديد من المشكلات الاكاديميه والاضطرابات النفسيه وتحسين
الصفات السلوكيه والمهارات وتعديل السلوك لدا الطلبه
الجامعيين. كما كشفت بعض الدراسات ) Abdel Wahab, 
Al Awwawi, 2004; Hamadneh, 2017 ;2010( اهميه
الارشاد الجمعي في حل مشكلات طلبه الجامعه في خفض قلق
الاختبار وتحسين عادات الاستذكار لدا عينه من الطلبه المتفوقين
في الجامعه. كما cin دراسه السفاسفه )2011 (Al Safasfeh, 
الدراسه
206
وقد نشات البرمجه اللغويه العصبيه ( Neuro Linguistic 
(Programming: NLP كعلم مستقل في منتصف سبعينيات
القرن الماضي الميلادي علا يد عالمي اللغويات الامريكيين جون
غريندر وريتشارد باندلر ) ;1979 Bandler Grinder, 
.(Grinder, 2 وتعاونا glob في وضع اصول البرمجه
اللغويه العصبيه بغيه تقديمها كعلم جديد في مجالات علم النفس,
بوصفها تتعامل مع العمليات النفس عصبيه Aa silly المستنده الا
وظائف الجهاز العصبيء. التي تنعكس من خلال افكار وسلوكات
الافراد ومشاعرهم. وكيف ان الاشخاص يتصرفون بناء علا برامج
عقليه تنظم لهم حياتهم اليوميه. وبالتالي تم تحديد اهم الوسائل
والنماذج السلوكيه الناجحه التي يتبعها المعالجون النفسيون الذين
تمكنوا من تحقيق النجاح في حياتهم. وتبين لهذين العالمين انهما
نجحا Lal في رسم معالم هذه النماذج وتعليمها للاخرين. وهي
النماذج التي سميت فيما بعد بنماذج البرمجه اللغويه العصبيه
.(Qandeel, 2012) 
وتعد البرمجه اللغويه العصبيه (NLP) نوها من
الاستراتيجيات المحايده. تحافظ علا تامل IU حتا اثناء
الخبرات الموتره. عن طريق ملاحظه الخبره نفسهاء وتشفيرها في
ظل رؤيه ايجابيه. وتلخيص الوعي بالمشاعر والافكار المرتبطه بها.
وقد تتم عن طريق اصدار استجابه سلوكيه day od تقود الا تغيير
الخبره السلبيه الا ايجابيه. ol بدون استجابه اي تامل وتدبر
الموقفء aged لرؤيه تنفيذيه Ala ge للتعبير عن المشاعر والافكار
المرتبطه بها ضمن غايات مقصوده )1981 .(Patterson, 
وتتضمن البرمجه اللغويه العصبيه (NLP) المفاهيم الثلاثه
الاتيه: البرمجه (Programming) وتدل علا برامج المعالجه
العقليه المتبعه في انتاج الافكار والمشاعر والتصرفات LAY Gal 
حيث يمكن استبدال هذه البرامج المالوفه باخرا جديده وايجابيه؛
واللغويه (Lingustic) وهي القدره علا استخدام كل من اللغه
المحكيه وغير المحكيه. وتشير الاولا الا كيفيه عكس كلمات معينه
ومجموعات من الكلمات لاحاديثنا ومفرداتنا العقليه. وتتناول الثانيه
ميكانزمات استخدام اللغه غير المحكيه التي تتمثل بالصمت والايماء
ولغه الوضعيات والحركات والعادات التي تكشف عن اساليبنا الفكريه
ومعتقداتنا؛ Lj العصبيه (Neuro) فتشير الا الجهاز العصبيء
وهو سبيل الحواس الخمسه التي يرا ويسمع ويشعر ويتذوق
ويشم بها الفرد )2009 (Alfiky, 
وتقوم البرمجه اللغويه العصبيه علا مجموعه من الافتراضات,
التي تحدد سبل تشكيل السلوك وجمع المعلومات والتقييمات
الشخصيه. ومن ابرز تلك الافتراضات: احترام رؤيه الفرد الاخر
للعالم؛ ووجود نيه حسنه وراء كل سلوك وعلا الانسان بذل اقصا",ARPD,finalpdfs/207.pdf,"['الارشاد الجمعيء', 'البرمجه اللغويه العصبيه', 'الصفات السلوكيه', 'مهارات الاتصال اللفظيء', 'الطلبه المتفوقين', 'جامعه نجران']"
