article_id,title,abstract_ar,authors,authors_en,general_field,publish_date,page1,page2,source,path,keywords
1211,maalءة نموذج التوقع-القيمة للدافعيه في تفسير العلاقات بين الاتجاه والكفاءه والجهد مع التحصيل الدراسي في الاحصاء وتوقعه,"تؤثر بعض العوامل النفسيه المعروفه علا التحصيل الدراسي للطالب. ومن هذه العوامل الاتجاه نحو تعلم الاحصاء والكفاءه الذاتيه والجهد المبذول. وقد تم فحص العلاقه بين هذه العوامل والتحصيل الدراسي من خلال نمذجه المعادلات البنائيه. وجمعت البيانات من خلال عينه تكونت من 288 من طلبه المرحله الجامعيه الاولا. والمسجلين في مقرر الاحصاء التربوي. استخدمت ثلاثه مقاييس من نوع التقرير الذاتي لقياس كل من: الاتجاه نحو الاحصاءء والكفاءه الذاتيه والجهد المبذول؛ وتم التحقق من ملاءمه ادوات الدراسه من خلال التحليل العاملي التوكيدي ومؤشرات المطابقه الملاءمه. اظهرت الدراسه باستخدام المعادلات البنائيه وجود علاقه داله احصائيا بين كل من الكفاءه الذاتيه والجهد المبذول مع التحصيل الدراسي والدرجه المتوقعه في المقررء وبنفس الوقت لم تظهر علاقه داله احصائيا بين الاتجاه نحو الاحصاء وكل من التحصيل الدراسي والدرجه المتوقعه في المقرر؛ مما يشير الا ملاءمه نموزج التوقع- القيمه كاحد نماذج الدافعيه. والذي يستطيع تفسير تباين التحصيل الدراسي في الاحصاء التربوي من خلال مؤشرات المطابقه التي ظهرت للنموذج. (الكلمات المفتاحيه: تدريس الاحصاءء التوقع-القيمه, الكفاءه الذاتيه. الجهد المبذولء المعادلات البنائيه).",['فaisal abdelfattah'],,Business,2017-01-01,"المجله الاردنيه في العلوم التربويه. مجلد 613 sae 4. 2017. 405 - 418
ملاءمه نموذج التوقع-القيمه للدافعيه في تفسير العلاقات بين الاتجاه
والكفاءه والجهد مع التحصيل الدراسي في الاحصاء وتوقعه
فيصل عبدالفتاح 
تاريخ تسلم البحث 2017/3/22
ملخص: تؤثر بعض العوامل النفسيه المعروفه علا التحصيل الدراسي
للطالب. ومن هذه العوامل الاتجاه نحو تعلم الاحصاء والكفاءه الذاتيه
والجهد المبذول. وقد تم فحص العلاقه بين هذه العوامل والتحصيل
الدراسي من خلال نمذجه المعادلات البنائيه. وجمعت البيانات من خلال
عينه تكونت من 288 من طلبه المرحله الجامعيه الاولا. والمسجلين في
مقرر الاحصاء التربوي. استخدمت ثلاثه مقاييس من نوع التقرير الذاتي
لقياس كل من: الاتجاه نحو الاحصاءء والكفاءه ALL والجهد المبذول؛
وقد تم التحقق من ملاءمه ادوات الدراسه من خلال التحليل العاملي
التوكيدي ومؤشرات المطابقه الملاءمه.
اظهرت gilts الدراسه باستخدام المعادلات البنائيه وجود علاقه داله احصائيا بين
كل من الكفاءه الذاتيه والجهد المبذول مع التحصيل الدراسي والدرجه المتوقعه
في المقررء وبنفس الوقت لم تظهر علاقه داله احصائيا بين الاتجاه نحو الاحصاء
وكل من التحصيل الدراسي والدرجه المتوقعه في المقرر؛ مما يشير الا ملاءمه
نموزج التوقع- القيمه كاحد نماذج الدافعيه. والذي يستطيع تفسير تباين التحصيل
الدراسي في الاحصاء التربوي من خلال مؤشرات المطابقه التي ظهرت للنموذج.
(الكلمات المفتاحيه: تدريس الاحصاءء التوقع-القيمه, الكفاءه الذاتيه. الجهد
المبذولء المعادلات البنائيه).
مقدمه: يعد موضوع الاحصاء مكونا اساسيا في كثير من البرامج
الاكاديميه في الجامعات. وهو يهدف الا اكساب الطلبه المعرفه بمجموعه
من المفاهيم الاحصائيه. والقدره علا التعامل مع الاساليب الكميه التي
تمكنهم من فهم وتفسير القضايا البحثيه المرتبطه بتخصصاتهم الجامعيه,
او تلك المحيطه بهم في الحياه اليوميه سواء المتعلقه منها بالتعليم اا
بالصحه او بالاقتصاد وغيرها من حقول المعرفه. وينظر المتخصصون في
التعليم العالي الا مقرر الاحصاء باعتباره من المقررات الهامه التي تقع
ضمن حزمه تعليم مهارات البحث العلمي.
ورغم اهميه مقرر مباداء الاحصاء في بناء مهارات الطلبه
واعدادهم لمهنه المستقبل؛ الا ان الطلبه انفسهم يرون انه من الموضوعات
الصعبه التي تشكل مصدر ضغط عليهم اثناء الدراسه. وقد لوحظ من
خلال تجارب التدريس المتعدده ان الطلبه يشيرون الا ان كثيرا من
المفاهيم الاحصائيه معقده وصعبه الفهم, مما يحول دون تطبيقها بكفاءه او
حتا التوصل الا استنتاجات مفيده من خلالها. ويتفاوت الطلبه في
مشاعرهم نحو مقررات الاحصاءء ومعتقداتهم الذاتيه التي تتمثل في
مستويات قلق مرتفعه قد يكون مردها عدم توفر الالفه الكافيه بمباداء
الرياضيات
)2015 التي تساعدهم علا اكتساب المفاهيم Aaland اا حتا ردود
افعال متمثله بالانزعاج والخوف من hill مما يحول دون تحقيق
(McGrath, Ferns, Greiner, Wanamaker, Brown,
* قسم ple النفسء جامعه الامام عبدالرحمن بن فيصلء المملكه Ly yall السعوديه.
حقوق الطبع محفوظه لجامعه tl go yall اربدء الاردن.
تاريخ قبوله 2017/5/22
Imam Abdulrahman Bin
Faisal Abdelfattah: Faisal
University, KSA.
efficacy, Effort, SEM).
ان الهدف من تعليم مقرر اساسيات ومبادئ الاحصاء للطلبه يتجاوز
الاهداف المعرفيه الا الاهداف الوجدانيه؛ فمن المتوقع بعد الانتهاء من
دراسه هذا المقررء ان يكون الطالب متاكدا ان باستطاعته فهم وتطبيق
الاساليب الاحصائيه في مجال مهنه المستقبلء Gly يستعملها في مجالات
حياته اليوميه المختلفه. وهذا يتحقق عند توفر نظره تعبر عن تثمين
الطلبه لتعلم مقرر الاحصاءء تمكنهم من النجاح فيه. ومن هنا تبرز الحاجه
الا التعرف علا العوامل التي تدفع الطلبه للمشاركه؛ والانخراط في مهمات
تعلم قد sui صعبه عليهم كالاحصاءء والخروج بمقترحات تساعدهم علا
تحقيق متطلبات تخرجهم., والنجاح في مهنه المستقبل وتجعل من مقررات
مبادئ الاحصاء اكثر متعه وفائده.","المجله الاردنيه في العلوم التربويه
وقد اجريت دراسات عديده لاستقصاء العوامل المؤثره في
نجاح الطلبه بمقررات الاحصاءء منها ما يتعلق بمتغيرات ديمغرافيه:
كجنس الطالب. وعمرهء ومستواه الدراسيء وتخصصه (سليم
وريان. 2009( او ما يتعلق بعوامل نفسيه مثل: الدافعيه. والكفاءه
الذاتيه. والاتجاهء وتوقع النجاح (2015 (McGrath et al, 
وغيرها من العوامل ذات العلاقه باداء الطالب في المهمات الكميه
ضمن متطلبات الاحصاء وتطبيقاته. واعاده بناء المحتوا الدراسا,
وجعله اكثر ارتباطا بالواقع ( Abd-El-Fattah, 2005; Williams, 
0 وخرجت هذه الدراسات بنتائج متباينه استنادا الا النماذج
ونموذج التوقع- القيمه بالتحديد كاكثر النماذج شهره. وشيوعا في
التعبير عن الاختلاف في اداء المهمات الاكاديميه.
ويمثل مفهوم الدافعيه للتعلم محورا هاما في العمليه التربويه؛
Sl يفستر الاسباب التي تدعو الطالب للانخراط. والمشاركه في
الانشطه التعليميه المختلفه. ويرا بروفي )2010 (Brophy, ان
الدافعيه للتعلم هي كفايه مكتسبه تتطور من خلال الخبره التراكميه
للطالب في المواقف التعليميه. وتنطوي الدافعيه علا شبكه من
التصورات والمهارات والقيم والاتجاهات التي تتطور جميعا مع مرور
الوقت. ونظرا لتفاوت مستوا الدافعيه لدا الطلبه الدارسينء
والذي قد يكون مرتفعا لدا البعض منهم منذ لحظه انضمامهم الا
مؤسسات التعليم. او قد يكون معززا بدوافع فرص العمل
المستقبليه للتخصص الذي سيدرسونه؛ الا ان البعض الاخر منهم
قد ياتي بمستوا دافعيه Gate للدراسه في التخصصء او في
المقرر الدراسي الذي سيسجلونه. نظرا GY هذا المقرر يمثل
واحدا من متطلبات التخرج من الجامعه. او انه ياتي ضمن حزمه
مقررات المتطلبات الاساسيه العامه في الجامعه. وبالتالي قد يتطور
مستوا الحماس لدا بعض الطلبه الاقل دافعيه عند دراسه احد
cl) yell في مقابل طلبه قد يتدنا مستوا حماسهم ومشاركتهم عند
التسجيل في مقرر دراسي معين.
ars بروفي (Brophy, 2004: p.4) الدافعيه علا انها:
مستوا الحماس ودرجه الاهتمام والانتباه ومستوا الجهد
المستثمر في التعلم من الطالب . وقد جاء نموذج التوقع- القيمه
judd Expectancy - Value الجهد الذي يبذله الطالب في
التعلم, باعتباره نتيجه لتفاعل مستوا توقعه من انه سيتمكن من
انجاز مهمه التعلم بنجاح (التوقع). والدرجه التي يثمن فيها ما
سيعود عليه من فرصته في المشاركه بتاديه المهمه نفسها (القيمه).
.(Cross, 2001) 
وهناك الكثير من المواقف التي لا تستكمل بنجاح بسبب
فقدان الاشخاص للشعور بانهم يمتلكون القدره لادائهاء او لانهم لم
يحققوا مستوا من الرضا الذاتي فيها. واستنادا الا هذا النموذج,
فان الطالب لن يستثمر lage في مهمه تعلم لا يستمتع بهاء ولا
تقود لشيء يعتبره ذا قيمه بالنسبه له. حتا لا كان يعتقد انه
سيتمكن من النجاح فيها. كما انه لن يبذل lage في مهمه تعلم ذات
406
قيمه بالنسبه له. اذا كان يعتقد انه لن يتمكن من النجاح فيها بغخض
النظر ان حاول صرف الجهد في تعلمهاء او لم يحاول.
وترتبط توقعات الطلبه بتصوراتهم الذاتيه حول مدا ثقتهم
بانفسهم؛ فالطالب يجب ان يمتلك مستوا من الثقه بحيث اذا
ترافقت الثقه مع جهد ملائم فانه سيتمكن من النجاح. واصبح من
المتعارف عليه لدا الباحثين ( :2002 , (Eccles Wigfield 
Cross, 2001 ان مظله الدافعيه تشتمل تطبيقات متعددهء التي
يمكن تنظيمها في اطار نموذج تفاعلي يربط التوقع بالقيمه.
ويوفر نموذج التوقع-القيمه [Uh هاما للتعرف علا
استراتيجيات الانخراط في الاداءء والتي تساعد التربويين
والمهتمين في رسم خطط التدخل للطلبه من ذوي مستوا الثقه
المتدني. والذين giles من توقع الفشلء مما يمنعهم من المشاركه
بفاعليه في التعلم. وتكمن الاشكاليه بشكل اوضح لدا الطلبه الذين
بعجزهم في تعلمها. وهذا مرده الا sal امرين: اولهماء عدم
تاكدهم مما سيفعلونه. او كيف سيفعلونه؛ او ثانيهما: انهم يشككون
في استطاعتهم بتاديته )2010 ٠ (Brophy, وبالتالي يبداون في
اختلاق الاعذار. او ينكرون الصعوبات التي يمرون بهاء ويدعون
انهم يفهمون مهمه التعلم او انهم قد يشاركون في اي انشطه
اخرا تشعرهم بالرضا عن ذواتهم, بدلا من البحث عن المعارف.
والمهارات المتعلقه Cages التعلم. وقد يحدث الانسحاب من مهمه
التعلم عندما تكون توقعات النجاح لدا الطالب مرتفعه؛ ولكنه يدرك
ان قيمه ماده التعلم متدنيه بالنسبه له؛ فيبدا باظهار شعور ثقه
زائده بنفسه. oly باستطاعته انجاز مهمه التعلم ولكنه لا يرا سببا
ظاهرا يدفعه الا المشاركه الفاعله في التعلم؛ فينصرف Yay من ذلك
الا الاستغراق في التفكير بامور الحياه خارج الغرفه الصفيه وشرود
الذهن. والانشغال مع زملائه في موضوعات بعيده عن موضع Bale 
التعلم وغيرها من مظاهر السلوك السلبي. وبالتالي يفتقد الا
اسباب المشاركه الفاعله في كلتي الحالتين نتيجه الا انخفاض توقع
claill اا عند ادراكه عدم اهميه مهمه التعلم.
ان كشف اسباب تدني المشاركه الفاعله والانخراط الملائم ف
مهمه التعلم, وفهمها بشكل افضل يمكن ان يساعد في رسم استراتيجيا
تعيد الطالب الا مهمه التعلم؛ كالتاثير عليه من خلال التاكيد علا اهميه
التعلم بالنسبه له وتثمينه. ومساعدته في المحافظه علا مستوا مرتفع من
التفاؤل ورسم توقعات ايجابيه حول قدراته. وامكانيه انجازه لمهمه التعلم
بنجاح في حال بذله لجهد ملائم. وقد اقترح هانسن (Brophy, 2004, p. 
Yous 18) يوضح فيه اشكال لاستجابات اربعه انماط من All يسيرون
عليها عندما يتاثر مستوا توقعهم بالنجاح ol نظرتهم لقيمه Bale 
التعلم بشكل ايجابي او سلبي.
0
م6",ARPD,finalpdfs/262.pdf,"['تدريس الاحصاء', 'التوقع-القيمة', 'الكفاءة الذاتية', 'الجهد المبذول', 'المعادلات البنائية']"
