article_id,title,abstract_ar,authors,authors_en,general_field,publish_date,page1,page2,source,path,keywords
615,استخدام نظريه امكانيه التعميم في تقدير ثبات اختبار تقييم كفاءه الطلاب في الرياضيات,"استخدمت الدراسه الحاليه نظريه امكانيه التعميم في تقدير ثبات اختبار تقييم كفاءه الطلاب في الرياضيات. واثناء الدراسه. طبق اختبار يشتمل تسع مهمات معقده موزعه علا ثلاث صيغ: ا) ثلاث مهمات محكمه البناء. ب) ثلاث مهمات غير محكمه البناء. ج) ثلاث مهمات ذات معلومات مشوشه, كاساس لتقييم كفاءه الاعداد والحساب. علا عينه مكونه من )331( طالبا فا السنه الرابعه ابتدائي. وقد شارك في عمليه تقييم اداء الطلاب ثلاثه مقدرين مدربين باستخدام شبكات تصحيح تحليليه وتم تحليل البيانات بواسطه تصميم ثنائي البعد متقاطع لالبودج مقدر باستخدام حزمه 150100 . اظهرت نتائج الدراسه وجود مصادر خطا كبيره راجعه الا اثر تفاعل الطالب مع المهمه والتاثير الرئيسي للفترات التي يجرا فيها الاختبار. ومن اجل ضمان مستويات ثبات مقبوله يجب زياده عدد المهمات وليس عدد المقدرين. كما ينبغي العنايه اثناء استخدام المهمات المعقده في قياسات تقييم الكفاءه.",['فاروق طباع'],,Arabic,2020-01-01,"استخدام نظريه امكانيه التعميم في تقدير ثبات اختبا
9 9 o
المجله الاردنيه في العلوم التربويه. مجلد 616 عدد 1. 2020. 18-1
ر تقييم كفاءه الرياضيات لدا طلاب السنه الرابعه ابتدائي
*
فاروق طباع
تاريخ تسلم البحث 2019/1/31
ملخص: استخدمت الدراسه الحاليه نظريه امكانيه التعميم في تقدير ثبات اختبار
تقييم كفاءه الطلاب في الرياضيات. واثناء الدراسه. طبق اختبار يشتمل تسع
مهمات معقده موزعه علا ثلاث صيغ: ا) ثلاث مهمات محكمه البناء. ب) ثلاث
مهمات غير محكمه البناء. ج) ثلاث مهمات ذات معلومات مشوشه, كاساس لتقييم
كفاءه الاعداد والحساب. علا عينه مكونه من )331( طالبا فا السنه الرابعه
ابتدائي. وقد شارك في عمليه تقييم اداء الطلاب ثلاثه مقدرين مدربين باستخدام
شبكات تصحيح تحليليه وتم تحليل البيانات بواسطه تصميم ثنائي البعد متقاطع
Lis طالبء Xdoge مقدر باستخدام حزمه 150100 . اظهرت نتائج الدراسه
وجود مصادر خطا كبيره راجعه الا اثر تفاعل الطالب مع المهمه والتاثير الرئيسي
للمهمه. ومن اجل ضمان مستويات ثبات مقبوله يجب زياده عدد المهمات وليس
عدد المقدرين. كما ينبغي العنايه اثناء استخدام المهمات المعقده في قياسات
تقييم الكفاءه.
(الكلمات المفتاحيه : نظريه التعميم,: الثبات. اختبار تقييم الكفاءه. مصادر تباين
الخطا. المهمات المعقده).
والمتخصصين في المجال التربوي خلال العقدين الماضيين. فمنذ ظهوره
كرد فعل علا الممارسات التقليديه احدث تغييرات شامله علا اجراءات
تقييم تعلم الطلبه. فقد كانت الممارسات التربويه تركز علا تقييم المعارف
والمهارات المتفرقه باستخدام اسئله الاختيار من state والصح والخطاء
والاجابات القصيره التي تميزت محتوياتها بسياقات مجرده. ثم انتقلت الا
استخدام اساليب بديله لتقييم الكفاءات تعتمد علا المهمات المعقده,
والمشكلات المفتوحه,. والمقالات. والمحادثات الشفهيه. والعروضء
والتجارب العمليه. والمشاريع؛ وملفات الاعمال...وغيرها ( 2004 Alam, 
Feuer Fulton, 1993 : Johson, Penny Gordon, 
: 2009( وتعتمد علا مهمات واقعيه متنوعه. وتتطلب بناء الاجابه من
طرف الطالبء. وتستدعي مهارات التفكير العلياء وتعتمد اثناء التصحيح
علا احكام ذاتيه وتستخدم عده مقدرين اثناء التقييم وتستدل علا
الاداء في مواقف متعدده ( Scallon, 2004; Segers, Dochy 
.(Cascallar, 2003 
وبالرغم من الخصائص المتميزه لاساليب تقييم الكفاءه. الا ان عمليه
فحص جودتها لا سيما abil تواجه مشكلات باستخدام اساليب النظريه
الكلاسيكيه للاختبار كالاستقرار عبر الزمن (طريقه الاختبار-اعاده
الاختبار). والاتساق بين المهمات (طريقه الاتساق الداخلي). واتساق
تقديرات المصححين (طريقه الاتفاق بين المقدرين) ( De Ketele 
.(Gerard, 2005 ; Scallon, 2004; Tabba, 2017 ويعود ذلك
حسب كرونباخ ولين وبرينان وهارتل ) Cronbach, Linn, Brennan 
Haertel, 1997 ( الا ان اساليب تقييم الكفاءه تتصف بسمات
اساسيه Bb انها تعتمد علا اختبارات محكيه المرجع, والمهمات
المستخدمه زات نهايه مفتوحه ومعقده تجعل من الطرق الكلاسيكيه لتقدير
* جامعه مولود معمري - الجزائر.
حقوق الطبع محفوظه لجامعه اليرموك, اربدء الاردن.
تاريخ قبوله 2019/8/25
ويتطلب اثناء تقدير ثبات اساليب تقييم الكفاءه ان تكون الظروف
التي يجرا Gab التقييم نفسها قدر الامكان لكل الطلبه. وتصحح اجاباتهم
مهمات متعدده. وتصحح اجاباتهم بواسطه Sue مقيمين. وفي Sue مواقف
لاتخان قرارات صائبه حول الطلبه ( Baartman, Bastiaens, 
وفي ظل هذه الشروط يتم تقييم الطالب بواسطه مجموعه من
المهمات الاختباريه التي يتم تقييمها باستخدام مجموعه من المقدرين
خلال فترات dil, ويتحصل فيها علا درجه شامله او كليه
(Universe score) واحده تمثل متوسط درجاته اذا jail كل المهمات
الممكنه. ceding اجاباته من طرف عده cyte وانجز مهمات الاختبار
في فترات معينه (1993 (Shavelson, Baxter Gao, ما قد يؤدي
الا اختلاف درجات الطالب باختلاف مجموعه المهمات الاختباريه التي
تقدم al وتختلف باختلاف المقدرين المعينين لتقييم ادائه. لان درجاته
تتاثر بمصادر خطا قياس راجعه الا اختلاف المهمات واختلاف المقدرين.","المجله الاردنيه فا العلوم التربويه
ومن بين الطرق التي يمكن ان توفر ادوات تقييم جيده معرفه
وتحديد حجم Lbs القياس الذي يمكن ان يسهم به كل بعد من
ابعاد خطا القياسء والتفاعل بين هذه الابعاد في الدرجات الملاحظه
التي يتم الحصول عليها باستخدام ادوات التقييم. وتمثل المهمات
الاختباريه والمقدرين احد الابعاد التي يمكن ان تؤثر علا ثبات
درجات اختبارات تقييم كفاءه الطلبه التي تعتمد علا المهمات
المعقده. وتمثل هذه المهمات (ture مهما لخطا القياس كون اداء
الطالب يمكن ان يتباين في هذه المجموعه من المهمات عن
مجموعه اخرا يتم اختيارها من نفس النطاق الواسع من المهمات
(Dunbar, Koretz Hoover, 1991) حيث يمكن ان تكون
بعض المهمات صعبه عند بعض الطلاب وسهله عند بعضهم. كما
يمكن ان يغير الطالب من استراتيجيات معالجته للمهمات من مهمه
الا اخر: ا )1992 .(Shavelson, Baxter Pine, ومن ثم
تمثل dine المهمات مصدر لخطا القياس عند محاوله تعميم درجات
تقييم اداء الطلاب من عينه من المهمات الا نطاق اوسع من
المهمات. وهو ما يعرف لدا بعض المؤلفين بخطا معاينه المهمه
.(Huang, 2009 ; Shavelson et al., 1993) 
وفيما بتعلق بالاشخاص المكلفين بتقييم كفاءه الطلبه, فيعتمد
علا المعلمين كمقيمين لاتخاذ قرارات تحديد مستوا الاداءء فهم
المسؤولون عن تقييم اداء طلبتهم؛ وهناك العديد من الادله البحثيه
التي تشير الا ضروره الاعتماد علا المعلمين في عمليه التقييم,
كما يمكن ان يمثلوا احد ابعاد خطا القياس لا سيما اذا طلب اليهم
اصدار احكام حول اداء الطلبه )2004 (Scallon, ومن ثم فان
المقدرين يمثلون مصدرا لخطا القياس؛ GY تقييماتهم للطلبه يمكن
فيميل بعضهم الا الصرامه. في حين يميل الاخرون الا التساهلء
كما يمكن ان تتاثر ايضا تقديراتهم باثر الهاله الناتج عن اختلاف
فترات تصحيح المهمات او الناتج عن استخدام موازين تقدير غير
واضحه )2011 (Casanova Demeuse, فعينه المقدرين او
الطلاب من عينه مقدرين الا نطاق اوسع من المقدرينء وها ما
وبهدف التحكم في مختلف مصادر خطا القياس التي تؤثر علا
ats درجات الطلبه في الاختبار. وتقديم مؤشرات احصائيه عن
الثبات التي تعبر عن دقه تعميم درجه الفرد الملاحظه في اختبار
معين مقارنه بالدرجه المتوسطه التي يحصل عليها ضمن الشروط
الممكنه التي سوف يخضع لها (مهماتء ومقدرين). فانه يتطلب
استخدام نظريه امكانيه التعميم التي تمتلك (Ub) مفاهيميا واسما
ومجموعه قويه من الاساليب الاحصائيه التي تسمح بمعالجه مختلف
مشكلات القياس ) Brennan, 2001 ; Cardinet, Johnson 
وتعد نظريه امكانيه التعميم امتدادا للنظريه الكلاسيكيه
للاختبارات من خلال تطبيق اساليب تحليل التباين (ANOVA) 
فهي اطار مفاهيمي واحصائي موسع للنظريه الكلاسيكيه للاختبارات
تسمح بتقدير دقه القياسات في مواقف تتاثر فيها بمصادر متعدده
ball وتقدم طرقا فعاله في تحسين اجراءات القياس
المستقبليه )2010 (Brennan, 2001 : Cardient et al., 
وقد قدمها كرونباخ وراجاراتنام وجليزر ) Cronbach, 
(Rajaratnam Gleser, 1993 لتحرير النظريه الكلاسيكيه
للاختبارات عن Gob ايجاد طرق كفيله لمعالجه مختلف مصادر
اخطاء القياس في الوقت نفسه. والتي قد تكون راجعه الا خصائص
الفاحصينء. او صيغ الاختبارء او فترات تطبيق QUAY او نوع
عبارات الاختبار...الخ.
حيث بامكانها ادماج مصادر متعدده للخطا وتقيم في الوقت نفسه
(ثبات الاختبار واعاده GLH Yl وثبات الاتساق الداخلي. والصدق
الظاهري. والثبات بين التقديرات). وتقدير ليس فقط تاثير ابعاد
القياس علا حده ولكن تاثيرات التفاعل ايضاء وتوسيع ثبات
الطالب )2008 .(Yin Shavelson, 
وفي اطار نظريه امكانيه التعميم يقوم الباحث بجمع
الملاحظات (مثلا: درجات الطلبه) في موقف معينء وهذه الدرجات
هي بمثابه عينه من الملاحظات التي يشتمل عليها نطاق شامل
من الملاحظات الذي يتضمن ظروف او شروط جمع الملاحظات 
اي المثيرات او المواقف المعينه التي يتم في ضوئها جمع
الملاحظات او الحصول علا القياسات )2000 (Allam, 
ومجموعه الشروط التي يتم فيها قياس اداء الطلاب في الاختبار
عباره عن نطاق الملاحظات المقبوله ( Universe of 
willy (Admissible Observations يحدده كل باحث حسب
سياق التقييم المرغوب. وكل قياس يتم فيه اخذ عينه يفترض ان
يكون قابلا للاستبدال بنطاقات اخرا. ويشير نطاق الملاحظات
المقبوله الا كل الابعاد التي يمكن اختيارها من اجل تصميم وضعيه
القياس. فهو اطار معاينه يتم فيه تحديد خصائص كل بعد يشتمل
عليه القياس (2010 (Meyer, ويمكن ان تتباين الدرجات التي
تنتمي الا نطاق Gold معين في اكثر من جانب او بعد (facet) 
ويمكن ان تكون الابعاد مهمات الاختبار التي Subs علا الطلبه او
المقدرين المكلفين بتصحيح اجابات الطلبه او الفترات التي يجرا
فيها الاختبار.",ARPD,finalpdfs/210.pdf,"['نظريه التعميم', 'الثبات', 'اختبار تقييم الكفاءه', 'مصادر تباين الخطأ', 'المهمات المعقده']"
