article_id,title,abstract_ar,authors,authors_en,general_field,publish_date,page1,page2,source,path,keywords
1210,اثر اسلوب التعامل مع القيم الشاذه في فاعليه معادله نموذجي اختبار,"هدفت الدراسه الا الكشف عن فاعليه معادله نموذجي اختبار حسب نظريه الاستجابه للفقره باختلاف اسلوب التعامل مع القيم الشاذه. ولتحقيق هدف الدراسه, تم استخدام الطريقه الخطيه لمعادله نموذجي الاختبار الوطني لضبط نوعيه التعليم لمبحث الرياضيات لطلبه الصف الرابع الاساسي بالاعتماد علا القدره )7( وفق تصميم المجموعات العشوائيه في المعادله. وتكون النموذج الاول من (35) فقره من نوع الاختيار من متعدد, وتكون النموذج الثاني من (36) فقره من نوع الاختيار من متعدد, وقد اختيرت عشوائيا استجابات (2000) طالبا وطالبه لكل نموذج. وتم استخدام محكي الخطا المعياري للمعادله والصدق التقاطعي للحكم علا فاعليه المعادله. واظهرت النتائج GL استبدال القيم الشاذه يؤدي الا زياده فاعليه Boles الاختبارات. كما كانت هناك فروق جوهريه بين الاوساط الحسابيه للاخطاء المعياريه للقدرات المعادله لصالح استبدال القيم الشاذه عند جميع مستويات القدره مقارنه JS من الاحتفاظ بالقيم الشاذه وحذفها. كما اظهرت النتائج Gly المعادله تكون اكثر فاعليه كلما اتجه مستوا القدره نحو وسط التوزيع. (الكلمات المفتاحيه: معادله الاختبارات. القيم الشاذه. الصدق التقاطعي؛ الخطا المعياري للمعادله).","['* *', 'Yarmouk University', 'Department of Educational Development and Quality Enhancement, Jordan', 'Yarmouk University', 'Faculty of Education, Jordan']",,Business,2017-01-01,"المجله الاردنيه في العلوم التربويه. مجلد 613 sae 4. 2017. 389 - 403
اثر اسلوب التعامل مع القيم الشاذه في فاعليه معادله نموذجي اختبار
* *
تاريخ تسلم البحث 2017/2/9
ملخص: هدفت الدراسه الا الكشف عن فاعليه معادله نموذجي اختبار
حسب نظريه الاستجابه للفقره باختلاف اسلوب التعامل مع القيم الشاذه.
ولتحقيق هدف الدراسه, تم استخدام الطريقه الخطيه لمعادله نموذجي
الاختبار الوطني لضبط نوعيه التعليم لمبحث الرياضيات لطلبه الصف الرابع
الاساسي بالاعتماد علا القدره )7( وفق تصميم المجموعات العشوائيه
في المعادله. وتكون النموذج الاول من (35) فقره من نوع الاختيار من
متعدد, وتكون النموذج الثاني من (36) فقره من نوع الاختيار من متعدد,
وقد اختيرت عشوائيا استجابات (2000) طالبا وطالبه لكل نموذج. وتم
استخدام محكي الخطا المعياري للمعادله والصدق التقاطعي للحكم علا
فاعليه المعادله.
واظهرت النتائج GL استبدال القيم الشاذه يؤدي الا زياده فاعليه Boles 
الاختبارات. كما كانت هناك فروق جوهريه بين الاوساط الحسابيه للاخطاء
المعياريه للقدرات المعادله لصالح استبدال القيم الشاذه عند جميع مستويات
القدره مقارنه JS من الاحتفاظ بالقيم الشاذه وحذفها. كما اظهرت النتائج Gly 
المعادله تكون اكثر فاعليه كلما اتجه مستوا القدره نحو وسط التوزيع.
(الكلمات المفتاحيه: معادله الاختبارات. القيم الشاذه. الصدق التقاطعي؛ الخطا
المعياري للمعادله).
مقدمه: Las الاختبارات التربويه من pal الادوات المستخدمه في
العمليه التعلميه التعليميه؛ اذ غالبا ما يتم استخدام درجات المفحوصين
علا تلك الاختبارات من المتخصصين التربويين لتزويدهم بمعلومات
تساعدهم في عمليه اتخاذ قرارات تربويه متعلقه بتقويم التطور التربوي
للمفحوصين. كتحويلهم الا برامج خاصه سواء اكانت اثرائيه ام علاجيه
lids (Hu, 2004) والنقل, والترفيع . ويواجه المتخصصون في
الاختبارات العديد من المواقف التي تتطلب اختبار مجموعات مختلفه من
المفحوصين باستخدام نماذج مختلفه من الاختبار كاختبارات القبول في
الجامعه واختبارات تحديد المستوا واختبارات مزاوله المهن ( Kolen 
.(Brennan, 2004 ويفترض في هذه النماذج انها تقيس السمه نفسها.
وهذا يتطلب من القائمين علا تلك الاختبارات ان يكونوا حريصين علا
اعداد نماذج اختبارات متكافئه. وهذا في الواقع pol غير قابل للتحقيق اذ
من الصعب تطوير اختبارات متكافته في المحتوا او الصعوبه او الثباتء
وبالتالي يصبح من غير العدل تطبيق تلك الاختبارات علا مجموعات
مختلفه من المفحوصين )2011 (Jimenez, 
لذلك ظهرت الحاجه الا معادله النماذج المختلفه للاختبارات. والتي
تهدف بشكل اساسي الا جعل الدرجات علا النماذج المختلفه متكافئه
وقابله للمقارنه. من خلال تعديل الفروق الناتجه من معاملات الصعوبه بين
تلك النماذج. وعندها تصبح المقارنه ممكنه بين الدرجات التي يحصل
عليها المفحوصون علا النماذج المختلفه. وتكون ذات معنا بغض النظر
عن نموذج الاختبار الذي Sib عليهم ) Hambleton Swaminathan, 
Kolen Brennan, 2004 ;1985(.
* الكادر العربي لتطوير وتحديث التعليم, الاردن.
** كليه التربيه. جامعه اليرموكء الاردن.
حقوق الطبع محفوظه لجامعه tl go yall اربدء الاردن.
تاريخ قبوله 2017/7/13
Yarmouk
Standard Error of Equating).
وهناك نوعان من المعادله: المعادله الافقيه. والمعادله العموديه.
وتفترض المعادله الافقيه ان صور الاختبار المختلفه تقيس السمه نفسهاء
وتكون الفقرات للصور المختلفه متقاربه في صعوبتهاء وتطبق علا
مجموعات متقاربه في مستوا قدرتها. وبالتالي يكون الهدف منها تعديل
الفروق الناتجه عن صعوبه الفقرات علا صورتي الاختبار. وتفترض
المعادله العموديه ان صور الاختبار المختلفه تقيس السمه نفستهاء وتكون
متباينه في صعوبتهاء وتطبق علا مجموعات متباينه في مستوا قدرتها.
اي ان السمه تقع علا متصل واسع المدا يحتاج الا عده اختبارات
لتغطيته. ويفترض في هذه الاختبارات ان تقيس السمه نفسهاء. بحيث يغطي
كل اختبار جزءا من المتصل. ونظرا لانه من غير المؤكد ان يكون نظام
الوحدات نفسه في جميع الاختبارات. تنشا الحاجه الا Hobs هذه
الاختبارات بحيث تكون العلامه المحققه علا اي منها مناظره لموقع علا
متصل السمه بدلاله وحده القياس نفسها مهما كان ذلك الموقع
.(Hambleton Swaminathan, 1985; Kolen Brennan, 2004)","المجله الاردنيه في العلوم التربويه
ويتم جمع البيانات التي تحتاجها عمليه معادله الاختبارات
(Crocker Algina, 1986; Kolen Brennan, 2004) من
خلال استخدام تصميم المجموعه Stalsll اا تصميم المجموعات
للفقرات AS pital او تصميم اختبار الجذع المشترك. او تصميم
المجموعات المتكافته للفقرات المشتركه. او تصميم المجموعات
وتعد الاخطاء من المصادر الاساسيه التا تؤثر علا دقه
معادله درجات الاختبارات. وقد حدد كولن وبرينان ( Kolen 
Guesi (Brennan,2004 من اخطاء المعادله للدرجات: الخطا
العشوائي والخطا المنتظم. ويعزا الخطا العشوائي الا اسلوب
المعاينه واستخدام العينات المختاره في تقدير الاوساط الحسابيه
والانحرافات المعياريه. والتي بدورها
المعادله. ويساعد اختيار عينات كبيره في ضبط هذا النوع من
الخطا وتخفيضه. ويظهر الخطا المنتظم نتيجه لعدم التزام الباحث
بشروط المعادله او انتهاك الافتراضات الاحصائيه المطلوبه. وعمليه
وتعد هذه الاخطاء من اكبر التحديات Gal تواجه عمليه
معادله الاختبارات وقد تختلف باختلاف تصميم المعادله وشكلها؛
فلكل تصميم شروطه ولكل شكل من اشكال المعادله افتراضاته.
ومساله الالتزام بالشروط وتحقيق الافتراضات تختلف باختلاف
التصميم وشكل المعادله. وهذا يستوجب البحث عن افضل
التصاميم والاشكال للمعادله. بحيث يتم الحصول علا اقل الاخطاء.
ورفع فاعليه المعادله الا الحد الاقصا.
وقد سهلت نظريه الاستجابه للفقره عمليه معادله الاختبارات.
ومن اهم ميزات هذه النظريه قدرتها علا وضع عده اختبارات Beg 
مجموعات من المفحوصين علا تدريج مشترك. وقد اظهرت
الدراسات (الشريفين. 2003 +2010 Hanson Lee Ban, 
gl (Beguin, 2002; Kim Kolen, 2006; اساليب المعادله
حسب نظريه الاستجابه للفقره افضل من الاساليب المعتمده علا
النظريه التقليديه. وهناك العديد من اشكال المعادله للاختبارات
aus نظريه الاستجابه للفقره ومن اهمها: معادله العلامه الحقيقيه
True Score Equating ومعادله العلامات الملاحظه/ الخام
ومعادله علامه القدره Ability Score Equating 
وقد تم تناول اثر العديد من المتغيرات علا فاعليه معادله
الاختبارات مثل الخصائص السيكومتريه للفقرات من صعوبه
وتمييز(اللمع, 2012( وطول الاختبار وحجم العينه (الحجيلي
2012( والاداء التفاضلي للفقره(الرحيل.2013؛الحياصات,
2011( وطرق تصحيح فقرات الصواب-الخطا المتعدد (الصمادي.
2006( وطريقه تصفيه المموهات في فقرات الاختيار من متعدد
(الكوفحي. 2013).
واظهر الادب التربوي ان معادله الاختبارات قد تتاثر بعامل
مهم اخر هو الفقرات المتطرفه في الفقرات المشتركه ( :2013 He, 
(Jimenez, 2011; Michaelides, 2003 فقد هدفت دراسه
ماكليدز )2003 (Michaelides, الا فحص تاثير الفقرات المشتركه
التي تسلك سلوكا مختلفا عن بقيه الفقرات ( Misbehaving 
(common items علا عمليه المعادله بالاعتماد علا نظريه
الاستجابه للفقره .(IRT-based equating) واشارت النتائج الا
Gl الفقرات المتطرقه عندما تكون سهله جدا او صعبه Soe تؤثر
علا احصاءات المعادله بغض النظر عن اسلوب المعادله.
كما sad pli وروجرز وفوكميروفيك ( Hu, Rogers 
(Vukmirovic, 2008 بدراسه هدفت الا مقارنه فاعليه المعادله
في حالتي حذف الفقرات المتطرفه او الاحتفاظ بها. وقد اشارت
نتائج الدراسه الا عدم اختلاف فاعليه المعادله بينهما في حاله
المجموعات المتكافته. ولكن في المجموعات غير المتكافته. كانت
فاعليه المعادله افضل عندما يتم حذف الفقرات المتطرفه.
وهدفت دراسه جيمنيز (2011 (Jimenez, الا فحص اثر
الفقرات المشتركه زات التقديرات المتطرفه لمعالم الصعوبه ومعالم
التمييز علا معادله الاختبارات. وقد اظهرت نتائج الدراسه بان
وجود الفقرات المتطرقه في الفقرات المشتركه يعمل علا زياده
اخطاء المعادله Ads النظر عن كون مجموعات الدراسه متكافته او
غير متكافئه وبغض النظر عن اسلوب المعادله المستخدم.
اما دراسه هي وسوي Silas وشن ( He Cui Fang 
(Chen, 2013 فهدفت الا تحديد الفقرات المتطرفه باستخدام
نموذج انحدار خطي. وفحص تاثير Yale علا معادله العلامه
الحقيقيه في نظريه الاستجابه للفقره. وقد اظهرت نتائج الدراسه
ان حذف الفقرات المتطرفه يقلل من اخطاء المعادله,. ويزيد من
فعاليتها.
كما اجرا هي )2013 (He, دراسه هدفت الا تطوير اساليب
جديده للحصول علا معاملات تحويل التدريج للتحقق من تاثير
الفقرات المشتركه المتطرفه. ومقارنه اداء تلك الاساليب علا فاعليه
معادله الاختبارات. وقد اشارت نتائج الدراسه الا ان اخطاء
المعادله تزداد بوجود فقرات متطرفه.
وهناك جانب اخر من التطرف علا درجه من الاهميه غير
الفقرات المتطرفه هو القيم الشاذه في درجات الافراد Outliers التي
ينبغي الكشف عنهاء وتحديد اسلوب التعامل معها. ويرا ريه( Ray, 
6) ان معظم المعالم الاحصائيه. مثل الاوساط الحسابيه,
والانحرافات المعياريه. ومعاملات الارتباط. وكل احصائي يعتمد
القيم الشاذه من امثلتها: اسلوب الانحراف المعياريء والدرجه
المعياريه. والدرجه المعياريه المعدله The Modified-Standard 
Score واسلوب توكي (الرسم الصندوقي) Tukey s 
Adjusted والرسم الصندوقي المعدل Method(Boxplot)",ARPD,finalpdfs/261.pdf,"['معادلة الاختبارات', 'القيم الشاذة', 'الصدق التقاطعي', 'خطا المعياري للمعادلة']"
