article_id,title,abstract_ar,authors,authors_en,general_field,publish_date,page1,page2,source,path,keywords
610,العلاقه بين مؤشرات التخطيط الاستراتيجي والاداء الجامعي في جامعه عدن,هدفت الدراسه الا الكشف عن العلاقه بين مؤشرات التخطيط الاستراتيجي والاداء الجامعي في جامعه عدن من وجهه نظر طلبه الدراسات العليا وخرجيها من خلال معرفه درجه توافر مؤشرات التخطيط الاستراتيجي، والاداء الجامعي. وفيما اذا وجدت فروق ذات دلاله احصائيه بين المتوسطات لاستجابات الطلبه في درجه توافر مؤشرات التخطيط الاستراتيجي والاداء الجامعي تعزا لمتغيري التخصص والمستوا العلمي. تكونت عينه الدراسه من )144( LDS اختيروا بالطريقه الطبقيه. واستخدمت استبانتان: الاولا لمؤشرات التخطيط الاستراتيجيء والثانيه للاداء الجامعي. اظهرت النتائج ان درجه توافر مؤشرات التخطيط الاستراتيجي والاداء الجامعي متوسطهء وكشفت وجود فروق في مؤشرات التخطيط الاستراتيجي ككل ومجالي الرساله والاهداف تعزا لمتغير التخصص. ووجود Gord في الاداء الجامعي ككل ومجالاتها Lagan لصالح طلبه الاداره، وبالنسبه لمتغير المستوا العلمي. تبين وجود فروق علا مجالي الرساله والاهداف، ووجود فروق للاداه الثانيه ككل ومجالاتها جميعا لصالح خريج دكتوراه حديثاء وللتفاعل بين المتغيرات وجود فروق لمجال العمليه التعليميه لصالح خريج دكتوراه حديثا من الاداره التربويه. كما اظهرت النتائج علاقه ارتباطيه طرديه قويه بين مؤشرات التخطيط الاستراتيجي والاداء الجامعي.,['اسوان حمزه'],,Arabic,2020-01-01,"المجله الاردنيه في العلوم التربويه. مجلد 16, sac 2. 2020. 189-173
العلاقه بين مؤشرات التخطيط الاستراتيجي والاداء الجامعي في جامعه عدن
0 *
اسوان حمزه
تاريخ تسلم البحث 2019/4/8
ملخص: هدفت الدراسه الا الكشف عن العلاقه بين مؤشرات التخطيط
الاستراتيجي والاداء الجامعي في جامعه عدن من وجهه نظر طلبه الدراسات العليا
وخريجيهاء من خلال معرفه درجه توافر مؤشرات التخطيط الاستراتيجي., والاداء
الجامعي. وفيما اذا وجدت فروق ذات دلاله احصائيه بين المتوسطات لاستجابات
الطلبه في درجه توافر مؤشرات التخطيط الاستراتيجي والاداء الجامعي تعزا
لمتغيري التخصص والمستوا العلمي. تكونت عينه الدراسه من )144( LDS 
اختيروا بالطريقه الطبقيه. واستخدمت استبانتان: الاولا لمؤشرات التخطيط
الاستراتيجيء والثانيه للاداء الجامعي. اظهرت النتائج ان درجه توافر مؤشرات
التخطيط الاستراتيجي والاداء الجامعي متوسطهء وكشفت وجود فروق في مؤشرات
التخطيط الاستراتيجي ككل ومجالي الرساله والاهداف تعزا لمتغير التخصص.
ووجود Gord في الاداء الجامعي ككل ومجالاتها Lagan لصالح طلبه الاداره,
وبالنسبه لمتغير المستوا العلمي. تبين وجود فروق علا مجالي الرساله
والاهداف, ووجود فروق للاداه الثانيه ككل ومجالاتها جميعا لصالح خريج دكتوراه
حديثاء وللتفاعل بين المتغيرات وجود فروق لمجال العمليه التعليميه لصالح خريج
دكتوراه حديثا من الاداره التربويه. كما اظهرت النتائج علاقه ارتباطيه طرديه قويه
بين مؤشرات التخطيط الاستراتيجي والاداء الجامعي.
(الكلمات المفتاحيه: التخطيط الاستراتيجي, الاداء الجامعي. الافداف
الاستراتيجبه. طلبه الدراسات العليا) ١ 
مقدمه: يشهد للجامعات بانها مؤسسات اكاديميه حيويه. تمثل
احدا حلقات الاستثمار الاساسيه للموارد البشريه. كونها تؤدي دورا
مهما في التغيير والتطوير والمشاركه في تنفيذ خطط التنميه الشامله لها.
والتخطيط الاستراتيجي هو احد مداخل اساليب التغيير الايجابي الهادف
للتطوير. حيث يعد الموجه الاساس للجامعات المعاصره للوصول الا اداء
متميز. ومن المتوقع ان يكون لكل جامعه تخطيط استراتيجي يحدد
اتجاهها برؤيه مستقبليه ثاقبه تسعا لبلوغهاء عبر رساله مدروسه توضح
الغايه من وجودهاء تترجمها اهداف منشوده تسعا لتحقيقها. لذا بات من
الاهميه بمكان فحص توافر مؤشرات التخطيط الاستراتيجي, لمعرفه فاعليه
تلك الجامعات علا تحقيق الاهداف التي وضعت من اجل القيام بادائها
الجامعي المطلوب. وتشكل اهميه الاداء الجامعي اساسا بارزا في رفع
الكفاءه والفاعليه الانتاجيه للجامعات. لنيل رضا اصحاب المصلحه فيهاء
الذي اصبح امرا ضرورياء ويجب اخذه بالاعتبار. وهنا تبرز الحاجه
للوقوف علا واقع الانجازات وتحديد الجوانب التي تحتاج التغيير
والتطويرء فالاداء الجامعي الفعال يساعد في تشخيص مدا ديناميكيه
سياسات الخدمات الجامعيه الاخرا وفاعليتها. كما لابد من معرفه العلاقه
بين التخطيط الاستراتيجي والاداء الجامعي.
* جامعه عدن- اليمن.
حقوق الطبع محفوظه لجامعه اليرموك. اربدء الاردن.
تاريخ قبوله 2019/6/30
The Relationship Between Strategic Planning
Aswan Hamza, University of Aden, Yeman.
ومن المتعارف عليه. ان الاهداف المتحققه والجهد المبذول في
تحسين الاداء الجامعي. والتركيز علا مصالح العملاء يشير الا الفاعليه
(Abbas, 2006) التي غالبا ما تستخدم لقياس La, cos الطلبه عن
جوده الخدمات الجامعيه في تلبيه احتياجاتهم وتوقعاتهم. ذلك ان مستوا
الرضا يؤثر علا قدره الجامعه علا جذب طلبه جدد والمحافظه علا
الطلبه الحاليين. وتستطيع الجامعه من خلالهم ان تحصل علا الاجابه عن
الكيفيه التي ينظر بها الطلبه الا ادائها ( Del Barrio Luque, 
29). ومما لا شك فيه. ان الجامعه التي تخطط استراتيجياء تتفوق في
ادائها علا الجامعات التي لا تعتمد التخطيط الاستراتيجي في
اهدافها. 0
تحفيق","المجله الاردنيه في العلوم التربويه
والاداء الجامعي الجيد والمتناسب ومتطلبات العصرء هو نتاج
لتلك الجامعه التي لديها تخطيط استراتيجي (2014 (Zoabi, 
اساسه قيم مستلهمه من المجتمع. ورؤيه مستقبليه ورساله تعكس
صوره واضحه (داخليا وخارجيا) عن الغرض الذي وجدت من
اجله. واهداف واقعيه قابله للقياس وموضوعه في ضوء Lay 
يمكن تحقيقها وفقا للقدرات والامكانات المتاحه ( Cowburn, 
5) والجدير SUL هنا ان التخطيط الاستراتيجا من اجل
الاستدامه في الجامعات يميل الا التركيز بقوه علا الانشطه
والخارجيه المعروفه للجامعه. وياخذ في الاعتبار متغيراتها الداخليه
dea Lilly مما يجعل القائمين عليها اكثر استجابه ess بتلك
الظروف والمتغيرات. وبالتالي تنميه عادات التفكير المستقبلي لهاء
لان تجاهل المسائل الداخليه والخارجيه قد يقود الا نتائج سلبيه
من خلال اتخاذ قرارات غير مجديه ( Bieler McKenzie, 
Rustam, 2004 ;2017(.
والتخطيط الاستراتيجي عمليه تحليليه مستمره لاختيار )449
لمكانه مستقبليه تقوم علا توقعات جميع المعنيين بهاء وبمستويات
اداء جامعي متميز.ء عن طريق تطوير اهداف واستراتيجيات
وسياسات. واتخاذ قرارات فعاله لتحقيقها :2008 (Ghoneim, 
.Druker, 1974) وبات تطبيق التخطيط الاستراتيجي ضروره
ملحه للمؤسسات. ان ارادت زياده قدراتها التنافسيه وتطوير ادائها.
الا ان الجامعات لا تمارس التخطيط الاستراتيجي نتيجه قله الموارد
الماليه المتاحه واعتمادها علا التمويل الحكومي ( Cowburn, 
5. وفي هذا السياق؛ الجامعات اليمنيه علا وجه العموم
وجامعه عدن علا day الخصوص ليست lias عن Sus ls 
اوضحت الاستراتيجيه الوطنيه للتعليم العالي في الجمهوريه اليمنيه
وخطه العمل المستقبليه )2010-2006( ان هناك عوامل ادت الا
اليمنيه علا استخدام مواردها استخداما
تردي في درجه الاداء. كما اكدت غياب
ضعف قدره الجامعات
جيداء ونجم عن ذلك
التخطيط الاستراتيجي, الا وجود رؤيه,
ورساله واضحه. واهداف استراتيجيه محدده ( Ministry of 
Higher Education and Scientific Research, 2006: 
41(
وينعكس النظام القيمي للجامعه علا عمليه التخطيط
الاستراتيجي والاداء الجامعي بها. وتنبثق القيم من الثقافه الجامعيه
التي تحرص الجامعه علا تعميمها وضمان التزام الاداره والطلبه
والموظفين بتطبيقاتها. فالقيم هي مجموع المبادئ. والمعتقدات,
والاتجاهات الاجتماعيه والاخلاقيه التي تتبناها المؤسسه وتحكم
سياستها وطريقه اتخاذ قراراتها Jas مشكلاتها ( Alfayyad, 
4). وتتمثل مبادئ الجامعه في الاستثمار الامثل في تعليم
الطلبه التي يجب ان توضع موضع التنفيذء ويقع علا عاتق الجامعه
الدور الفاعل في تكوين المواطن الصالح المستنيرء الذي من
المفترض ان تتميز شخصيته بالسلوك الاخلاقي الذي توجهه
حيث تفتقر الجامعات
القيم )2014 (Alageel Alhyary, وقد Las زياده اهتمام
المؤسسات التربويه بتدريس بعض المقررات ذات العلاقه باخلاقيات
المهنه التي يتوجه الطالب لدراستها (2011 (Aldijani, ذلك ان
الطلبه قادمون من بيئات مختلفه بمفاهيم ومعتقدات متنوعه. فضلا
عن تاثرهم بافكار قد تكون غير ملائمه لقيم ومبادئ البيئه الجامعيه
التا يشكلون المكون الاساس لها. وبالتالا يعول علا الجامعات
اليمنيه عامه وجامعه عدن خاصه في التعامل معهم بشفافيه من
خلال نشر quill والرؤيه. والرساله. والاهداف بشكل سليم,
واشراكهم في نشاطات تؤدي الا فهمهم لهاء بحيث يعيها ويتبناها
والرؤيه هي الحاله المثاليه التي ينبغي الوصول اليهاء وتعكس
Li .(Alkubaisi, 2006 ( الرساله فهي وثيقه واضحه تؤسس
علا القيم والهويه. وتحدد الغايه من وجود الجامعه والغرض الذي
انشئت من اجله )2014 .(Zoabi, ويجب ان تكون رساله الجامعه
محدده بخصائص تميزها عن الجامعات الاخرا. وتمكنها من توسيع
انشطتها دون الحاجه الا اعاده صياغتها )2004 (Rustam, 
والاهداف الاستراتيجيه هي النتائج النهائيه لنشاطات تتم بطريقه
عاليه التنظيم ء وتعبر عن Aull للانتقال من الموقف الحالي الا
الموقف المستهدف. الذي يزيد نوعيا القدره علا الانجاز عن
الموقف الحالي )2014 dies (Zoabi, تقع علا جامعه عدن
تحديدا المسئوليه المباشره في تحقيق الاهداف التي تضمن اداء
جامعي بمستويات علميه رفيعه؛ تلبي احتياجات الطلبه ويتوخاها
المجتمع. ويستلزم منها معرفه يقينه بالاهداف التي تسعا الا
تحقيقهاء ومدا قدرتها علا ذلك بكفاءه وفعاليه. وتطويرها
باستمرار بما يخدم الواقع الذي يغلب عليه طابع التغيير. وهو ما
اشار اليه ويلين وهنجر )2004 ol: (Wheelen, Hunger, 
الاستراتيجيه هي خطط وانشطه المؤسسه التي يتم وضعها بطريقه
تضمن درجه من التطابق بين الرساله والاهداف وبين الرساله
dilly التي تعمل بها بكفاءه عاليه وبصوره فعاله.
والاداء ga درجه تقدم العمليات التي تحقق فيها المؤسسه
اهدافها )2010 (Aldawi, والاداء الجامعي هو المحصله النهائيه
للجهود. او النشاطات. او العمليات. اوالسلوكيات. التا تتعلق
بالاهداف التا تسعا المؤسسه الا تحقيقهاء وذلك في اطار التاثيرات
البيئيه المتبادله (2011 (Rabaya, والعمليه التعليميه هي عمليه
محوريه في الاداء الجامعي لها اهداف ضمن اهداف البرنامج
التعليمي ككل )2007 (Alabidi Alabadi, والبحث العلمي
هو مجموعه الجهود المنظمه التي تستخدم الاسلوب العلمي
وقواعد الطريقه العلميه بهدف اكتشاف معارف جديده تساعد فا
تحسين الاداء والحصول علا جوده عاليه للمخرجات والخدمات
.(Obaidat, Abdul-Haq 4035, 2004) ولذا يتطلب
قياس درجه الاداء الجامعي وضع اسس موضوعيه وعادله لضمان
تحسينه. ويشترط توافر اداء ملموس ومعمول به من المستفيدين",ARPD,finalpdfs/205.pdf,"['التخطيط الاستراتيجي', 'الاداء الجامعي', 'الافداف الاستراتيجبه', 'طلبه الدراسات العليا']"
